rating,date,coment_title,coment_description
4,24 febrero 2015,Disfrute de este lago,"Tuvimos un viaje de un día al Lago, el tiempo era bastante removible sol, viento, lluvia, pero realmente disfrutamos, el lago fue muy difícil con olas de casi 2 metros, pero esto solo añadió a la diversión, el barco rebotando alrededor y lo bestia.Las islas flotantes son muy interesantes la gente es muy amable.El almuerzo fue muy bueno, teníamos truchas en el lago y una sopa casera local.En todo el día muy agradable.Hacía un poco de frío en unas cuantas ocasiones así que lleva un suéter y una luz chaqueta impermeable y no te olvides de un sombrero o gorra. !!!!!La escalada hasta el pueblo de la isla principal no es bueno si estás ancianos o discapacitados y arduo trabajo debido a la altitud."
4,14 febrero 2015,Uno de los lugares más increíbles visuales en el mundo,"Para disfrutar verdaderamente, tienes que hacer la excursión de dos días y permanecer en la isla por una noche. Es la única manera puede conocer realmente la parte más asombrosa de la cima de Pachatata y Pachamama. Las familias locales están muy bien. Las disposiciones para dormir son ... Rústico. Los grupos de excursión el plomo los tours son impredecible. Nuestra primera guía era bueno, pero él vierten nosotros y nos dijo que esperar a la siguiente barco ya que estábamos en la noche. La siguiente guía era pésimo, y yo sé hablar español e inglés, y me di cuenta que él no repetir lo que dijo en ambos idiomas pero explicó media en inglés y la otra mitad es español. También tuvimos que esperar 2 horas desde que quería añadir algunas show-ups tarde sowe perdió en un montón de tiempo en la cima de la montaña. Tuvimos que esperar otra hora por las mismas personas en la mañana. Estaban más preocupados con unos cuantos dólares más que un buen recorrido. Lago Titicaca es de 5 estrellas pero las excursiones son 1 estrellas."
5,31 enero 2015,Experiencia única- hotel Titilaka brilla,"Compramos una estancia con todo incluido en el hotel Titilaka de ver la zona. Está fuera de la ciudad en el lago. Las vistas son preciosas. Hay excursiones mañana y de la tarde. El viaje a Tequila isla era un poco agotador debido a la altitud, pero el guía era paciente y la oportunidad de ver la cultura local estaba bien vale la pena. Las islas flotantes era increíble -- Reed artificial islas donde vive la gente. Nos recibió una explicación detallada de cómo las islas están construidas. Este fue el único lugar donde había un poco de presión para comprar artesanías. (fueron muy agradables, pero estamos en un período de miniaturización.) hicimos un poco el ciclismo de montaña, divertido poder decir que se encendía en 12,500 pies. También asistieron a un festival local. No fue la excursión programada, pero el guía sugirió el cambio y que bien vale la pena. Todas las guías hablaba un inglés excelente.El hotel en sí es muy internacional. No cumplir los estadounidenses, pero inglés y español hablado por casi todo el mundo. La noche ""happy hour"" era una oportunidad maravillosa de conocer gente. El menú era extenso, basada en platos e ingredientes locales, y bastante bueno. Los vinos de la casa, incluido en el paquete, era muy agradable y había una amplia selección. El servicio era genial.Caminamos por la ciudad local varias veces y todo el mundo fue muy amable. Está claro el hotel hace un esfuerzo para ser un aspecto positivo de la comunidad."
5,28 enero 2015,Hermoso y tranquilo,"Acabamos de pasar dos días en el Lago Titicaca y están felices de haberlo hecho! El lago es precioso. Tomamos un paseo en barco de día ayer, parando en las islas de los Uros e Isla Taquile. Las islas de los Uros son islas flotantes, hechas de cañas y fue fascinante para averiguar sobre la vida en estas islas. En la isla de Taquile nos hicimos una caminata y comimos en una casa en la cima de una colina, con unas vistas increíbles. En ambos casos, la gente era muy amable y dispuesto a compartir la vida y el tiempo con nosotros. Si estás en Perú, esto sin duda vale la pena una visita."
5,22 enero 2015,Lugar favorito en Perú,"He estado en el Amazonas, Machu Picchu, el desierto, caminamos mucho de los picos, y el Lago Titicaca es mi favorito personal. Comprendo que no es para todo el mundo, pero me pareció extremadamente tranquilo y sereno. El agua es tan limpia y clara, y las vistas desde Isla Taquile están fenomenal. Las islas flotantes Uros sonó mi mente. Había leído sobre ellos desde que era un niño, y que superó todas las expectativas. La comida local era genial, y me pareció que la cultura nativa extremadamente rico. ¡Qué lugar tan maravilloso."
5,21 enero 2015,Lago Titicaca,"Este tiene que ser una de las experiencias más increíbles, viajar en el más alto y más grande del mundo de agua fresca. Es como un mar alta altitud. El Reed asentamientos y los barcos de juncos son extraordinarias, como son los pueblos indígenas Aymara, las mujeres con sus trajes coloridos, vastas amplias flared faldas, el icónico bombín jaunty pequeños sombreros y largo plaited_nus tassles con secador. Las formaciones de nubes, y reflexiones de éstos en las tranquilas aguas azules son inspirador. El único inconveniente es aplicable en general a todo el mundo, que es la ""industrial"" nivel del turismo, y la presión para ""ven, ver y comprar"" de casi todas partes."
4,10 enero 2015,Lago Titicaca con Transturin,"Nuestro viaje de Puno a La Paz incorporaba un viaje de una noche en el Lago Titicaca en un catamarán.La compañía para la pierna boliviano de nuestro viaje era Transturin sudamericana y fueron excelentes. Lago Titicaca es un lugar increíble, el tamaño del lago es mente boggling. El viaje incluye excursiones a Sun Island y involucrados visitando pre-inca lugares, así como la Inca Jardín y complejo Inti Wata. El catamarán era cómoda (aunque las cabañas estaban muy compacto) y sólo había dos parejas a bordo, incluidos nosotros mismos. Mi único problema tenía que ver con dormir en altitud, lo que me pareció muy difícil en Bolivia y Perú. Nuestro guía era excepcional, ella fue muy amable y tenía conocimiento excepcional, lo que hizo un viaje muy agradable. Muy recomendable."
5,8 enero 2015,Otro de primera,"Los peruanos y bolivianos vive en camas independientes de cañas en el lago! Cruce de Bolivia a Perú en autobús es una experiencia, todos los seres humanos en una barcaza mientras que el autobús va en otra (muy cutre) Barge! Pasamos toda la travesía esperando para el barco con el autobús de lavabo y tomar todas nuestras posesiones con los alrededores Milán ofrece todos los!!"
5,6 enero 2015,Ir con la excursión local colectivo.,"Nosotros hicimos la reserva el día antes por caminar hasta el muelle de Puno y encontrar la excursión local colectivo. Estoy 100% recomendaría ir con la empresa local, hay un montón de empresas en el muelle, por lo que pregunta por ahí para encontrar la adecuada (fue hace un tiempo y no recuerdo si tenían un nombre - lo siento que no es en absoluto atento! ). La empresa local te lleva a visitar las islas de los Uros (las islas hechas de juncos) y luego en Amantani isla donde con un Homestay. Mi amigo y yo nos alojamos con otra pareja en el mismo lugar, teníamos dos habitaciones por supuesto. Llegamos por la tarde y tuvimos tiempo para explorar la isla. Hicimos una excursión a la cima y visitamos los sitios, y lo recomiendo sin duda. Nuestro anfitrión nos preparó una cena familiar en su horno de barro, y nos ayudó, que estaba muy bien. El personal en nuestro hotel en Puno recomendado arroz y azúcar como regalos para nuestra familia anfitriona desde básicos no son fácilmente disponibles en las islas. Al día siguiente visitamos Isla Taquile y tenía el día a explorar allí antes de regresar por la noche a Puno. Fueron unos bonitos y relajantes 2 días."
5,23 diciembre 2014,Algunos consejos para que su experiencia sea buena Lake,"Sólo algunos consejos desde mi perspectiva:Su guía que marca la diferencia. Una buena investigación y no es barato.Ir a una pequeña isla, no los grandes de trampa para turistas.Ir a Isla Taquile con una buena guía local.Una buena excursión comenzará a las 8 de la mañana y volverá en el muelle por unos 5.El lago es absolutamente precioso."
4,19 diciembre 2014,Una buena experiencia. Sin duda merece la pena una visita,"Lo hicimos con G aventuras de Puno.Un largo viaje en coche desde Cuzco en un autobús que estaba autobús estilo ... muy cómoda para las 7 horas o así ... reclinado asientos, etc.La excursión en el lago comenzó en gastroenteritis transmisible Puno muelles ... te olvidas debido a su tamaño que es un lago y no un mar!Fuimos en barco a unas cuantas islas y aprendido sobre los lugareños ... cómo crear artesanías, etc.Un gran almuerzo puesto por uno de los lugareños en otra isla ... unos 40 soles cada uno, pero fue preparado im una fogata bajo la tierra con piedras calientes. Estupenda comidaislas flotantes eran bastante frío para ver y cómo se construyó ... probablemente lo más destacable del lago para mí ... pero no mucho más que las cosas, supongo.Un gran lugar para visitar ... poco frío en el agua. 1 día en el lago es probablemente suficiente.Si no te importa hacer un largo día múltiple tour puedes coger la excursión en barco por el día por separado."
5,3 diciembre 2014,"intercambio cultural, lago Titicaca","Lago Titicaca es enorme y preciosa, las montañas nevadas en Bolivia son el telón de fondo. Nuestra primera parada fue una flauta isla entre los Uros islas flotantes. Nuestro guía maravilloso Manuel nunca nos apuraron cualquier parte de nuestra experiencia, así que tuvimos tiempo para conversar con la familia acerca de su vida en las islas y qué cambios que estaban viviendo con el crecimiento del turismo, etc. que luego nos dirigimos a Amantani para una estancia de una noche. La familia era acogedor y amable y el alojamiento cómodo y familiar comidas deliciosas. Vimos la puesta de sol desde la cima de la isla con 4000 metros sobre el nivel del mar, impresionante y vestida con ropa local más tarde fuimos a bailar en el hall de la comunidad. Al día siguiente nos nuestra despedida y nos dirigimos a Isla Tequile eran los hombres están knitters principal y los tejedores de maestro de las mujeres. Caminamos hasta la plaza más de 3000 metros sobre el nivel del mar un poco concentrado comercial y luego a almorzar en una casa local con una impresionante vista de la isla y el lago. Después de 2 días atravesando el lago verdaderamente impresionante que nos volvimos a Puno. Una experiencia fantástica en la que puede aprender mucho sobre la cultura y las costumbres del legendario Lago Titicaca."
5,3 diciembre 2014,Un montón de tesoros geológicos e historia natural,"Pasamos una noche en Amanti isla durante una excursión. Como un aficionado a los suelos y geología que era para cazar andisols, un tipo de suelo y me pareció, entre otras rocas interesantes en la isla. El lago en sí es impresionante y no muy frío, me imagino que con el viento bastante a buscarla puede desarrollar así que prepárate. Hay un montón de especies de aves presentes interesante así que traiga un largo lente cámara o unos prismáticos."
5,30 noviembre 2014,INCREÍBLE,"El lago es fantástico y lleva la energía de lo divino. El lago ofrece oportunidades para explorar las magníficas islas, donde la mayoría de los representantes Amantani es los en la práctica esotérica, no te pierdas al menos una noche allí. amaneceres y puestas de sol son espectaculares."
5,29 noviembre 2014,Un maravilloso día,"Nuestro día comenzó con un corto viaje en barco a las islas de juncos Uros. Me pareció encantador y muy interesante. Me encanta estar expuestos a nuevas culturas y formas de vida y nuestra guía era claro sobre cómo la manera en que personas de Uros viven ahora no es lo mismo que en años anteriores. Sí, tienen fuerabordas en sus barcos y teléfonos y televisores de celda, pero esto no le resta valor al hecho de que lo hagan efectivamente tienen un estilo único de la vida. Si no es tan auténtico como lo fue una vez, entonces yo no los culpo para moverse con los tiempos. Me pareció que la intervención del Presidente de la isla muy interesante. Sin embargo, nos trataron con un paseo en barco a la isla capital y estaban en el Presidente y su esposa! Desde aquí nos fuimos por otras 2 horas a la isla de tequila. Me fue cautivado por la vida, tan diferentes a las nuestras. Aquí no hay medios de transporte, no hay bicicletas, tractores, o incluso carretillas! Las personas viven de manera cooperativa y tienen una manera única de indicando que está disponible para el matrimonio y quién no. Esto es todo lo que hacer con la ropa los hombres llevan no menos de todos los sombreros que los hombres está pendiente! Me encantó esta visita. Los niños también a la escuela y yo nos conocimos de cuatro años a casa por ella tras su día de aprendizaje. Una maravilla! Así que seguro! Si como yo te gusta explorar distintas maneras de vivir y diferentes culturas, esta visita es para ti."
4,25 noviembre 2014,Lago Titicaca experiencia,"El hombre islas son la pena ver y ver cómo utilizan los recursos que tienen es increíble. El viaje al otro lado del lago vale la pena sólo para saber que has estado en uno de los mayores lagos de agua dulce en el mundo y tan lejos por encima del nivel del mar, es increíble. La visita a la isla Tequile fue un poco decepcionante. Visitar una escuela para niños era increíble ver cómo aprender que en realidad era una luz alta. Plaza de la ciudad fue muy decepcionante, demasiado tiempo sentados alrededor era aburrido, no hay mucho que ver en ese momento, el paseo hasta era difícil ir y agotadores teniendo en cuenta el clima. Incluso ir era difícil en las rodillas. Mi sugerencia si quieres ir a esa isla visita los niños en su escuela. Son amables y felices y disfrutar los turistas y tomar algo para ellos cualquier papelería hará que su día. Este ahorro de tiempo perdido en la plaza. Organizamos las visitas escolares nosotros mismos con la ayuda de guías."
1,20 noviembre 2014,No te molestes,"Estoy muy sorprendido de ver otros pueblos calificación este lugar tan altamente. Sí, el lago es muy agradable, pero toda la cosa es una trampa turística completa.Las islas flotantes son una mentira completa y son sólo para turistas y residentes tratando de vender la misma cosas que ver por todas partes.También hicimos una estancia de la casa y, para ser sincero no me molestaría con esto ya que no había nada interesante que hacer en la isla.No vale la pena el esfuerzo de llegar allí y se puede pasar el tiempo haciendo algo mucho más interesante."
4,11 noviembre 2014,humilde experiencia,"No sólo me abatidos por la maravilla natural, sino también por la vida simple, primitiva diaria viven los vecinos. Que utilizan sus recursos tanto como les sea posible y creativa. ¿Quién pensaría paja sencilla puede hacer Shelter, cama, mesas e incluso la gente baja viven en?El almuerzo es normalmente con el tour de funcionamiento en forma de buffet. En efecto, es bastante bueno, con una exhibición de variedades peruanas.Aunque se ha convertido en la excursión más comercial, entiendo cam traen ingresos extra puede ayudar a mejorar su nivel de vida. Así que ir antes de que se pierde la esencia."
5,1 noviembre 2014,Increíble,el lago más alto navegable. Tienes la oportunidad de ver las islas flotantes de Uros. Agua plana completamente azul por millas. Se puede visitar los pueblos de los alrededores y ver cómo cocinan y viven en sus islas.
4,28 octubre 2014,Lago Titicaca y Homestay con Mystery Perú,"Hicimos una reserva en el Lago Titicaca Classic Homestay Tour (2 días / 1 noche) con misterio Perú para nuestro viaje a principios de julio. En Puno, la noche antes de que nos fuéramos en esta excursión, una mujer llamada María vino a nuestro hotel y revisó el itinerario del viaje. Esto fue una agradable sorpresa y bien acogidos como este no fue organizado anteriormente. Creo que tuvimos suerte habíamos parado en el hotel antes de continuar a cenar o demás nos habríamos perdido su llamada y reuniones.En general, la visita entera transcurrió sin problemas. Como han dicho otros, puede que no importa a través de los cuales se reserve ya que todos los visitantes se combinan en unos barcos para el Lago Titicaca tours. Tuvimos un gran guía durante toda la excursión, me hubiese gustado observó que su nombre! Su inglés y conocimiento cultural eran excelentes.Realmente disfrutamos de la excursión de Munay aquella era, una de las islas flotantes de Uros. Aquí, nos enteramos Reed casas y cómo las islas están hechas y mantenido con una breve demostración. También pudimos ver el interior de una de las casas locales y luego dimos un paseo relajante en uno de los botes de juncos de la isla.La próxima parada era Amantani isla donde Dividimos fuera de nuestro grupo y fui con una de las ""Mamas de la isla"" para nuestro Homestay. Nuestra Mama era Jubita. Ella hablaba Aymara, una cantidad limitada de español, y no hablan inglés. Por suerte, nos hablaba un poco de español y podían comunicarse en condiciones básicas sobre nuestras familias y medios de subsistencia.El Homestay era un poco complicado debido a la barrera del idioma pero ella era agradable y hospitalario. Nos alojamos con ella, su hija aqueja y padres de su moderno-Ish casa. Como han mencionado otros visitantes, no hay electricidad. Teníamos nuestra propia habitación, que estaba decorada con lo básico, incluyendo un montón de ropa de cama por las noches frías. Ella servía básico pero nutritiva comida vegetariana en ella cocina--a salteados con arroz, huevos y verduras, y sopa de verduras. Más tarde nos enteramos de que su comida favorita es el pollo, si hubiéramos sabido, nos ha traído algunos en vez de en el housewarming regalos de frutas y hortalizas. Comimos en la cocina con ella y sólo vimos su hija y de los padres en pasando. Decidimos ir a la cama temprano en vez de ir a la danza de la comunidad/social (que nos dijeron que era un puesto para los turistas). En general, el Homestay estaba bien.Por la tarde, Jubita entramos nos hace volver a la plaza de la isla donde reunirse con nuestro grupo de tour de caminata templo Pachamama. Al principio nos dieron la opción de elegir entre el senderismo a la Pachamama o Pachatata templo, pero estábamos convencidos de que nos habría más vistas panorámicas desde Pachamama. De hecho, tuvimos una vista de una hermosa puesta de sol. La caminata, aunque no es caro, aunque sigue siendo un desafío en la altitud.La excursión continuó al día siguiente con una visita a Isla Taquile, el único lugar durante nuestro viaje donde vimos tricotar hombres. Tuvimos un almuerzo muy agradable después que incluía una demostración de desgaste local (cómo vestir trasmite estado civil) y el uso de hierbas como detergente.Por último, llevar consigo dinero en efectivo. No hay cajeros automáticos y habrá gente vendiendo cosas todas partes, Uros, su familia Homestay, la caminata a la Pachamama, Isla Taquile.Como nota al margen, después de nuestro viaje a Perú, nos enteramos a un futuro examen dos cosas:1. Otro tour operador, Inka lago, ofrece un Homestay en Uros isla. Es una isla Amantani geológica con casas más modernas. Parte de mí deseaba que habíamos reservado un Homestay en Uros isla para la experiencia de dormir en los juncos casas en las islas de juncos.2. Algunos tour operadores cobran menos para sus excursiones que realmente significa la familia Homestay recibe menos dinero al operador. No estábamos seguros de misterio Perú, así que le dimos propina Jubita bien. que habíamos aprendido de otros en la excursión que se suponía que tenían que pagar unos 20 dólares por persona en dinero en efectivo para el Homestay a su Mama. Habíamos reservado Mystery Perú basada en unas pocas críticas en línea que parecía verdaderas. Nos quedamos muy satisfechos con el misterio Perú, pero nos sentimos mal informada de estas cosas que han tomado en cuenta."
4,27 octubre 2014,Enorme lago,Nuestro tour de barco a Uros Flotando Reed islas era simplemente genial. Caminar en las islas y aprender cómo se realizan y ver cómo viven y pasar su tiempo era muy interesante.Cuando viento proviene de sus islas puede subir a 15 kms. Disfrutamos de la artesanía que hacer y comprar algunos. Otras dos horas y media en el lago nos llevó a Taguille Island es una isla natural.Esto no fue tan interesante y un largo camino para llegar a ella. Al menos ahora hay una rampa para llegar a la cima y no tienes que navegar por los grandes pasos. Os recomiendo visitar islas flotantes como un largo día de lo contrario.
5,26 octubre 2014,Viaje de diversión,"Me encantó todo. Especialmente el barco rápido tours. El dinero extra valió la pena para interrumpir un par de horas de tiempo de viaje a las islas, así como llegar antes las grandes multitudes."
5,22 octubre 2014,Lago Titicaca Express Tour con Edgar aventuras,Hicimos la excursión con Edgar aventuras a principios de octubre. Aunque se paga más de lo normal para una excursión que vale cada centavo! Y parte de ella va a apoyar las comunidades locales. El barco es cómodo y rápido.El servicio fue muy profesional y la guía Percy era increíble. Usted podrá ver lugares menos turísticos y disfrutar de un delicioso almuerzo especial preparado de la manera tradicional usando hornos subterráneos! Edgar y su esposa se unieron la excursión que lo hizo muy personal e informativo. las islas de los Uros dejó una impresión inolvidable con nosotros. Recomendamos encarecidamente esta excursión!
5,22 octubre 2014,Isla flotante,Disfrutamos de una mañana mágica retroceder en el tiempo mientras que hemos tenido las islas de los Uros (islas flotantes) hizo de juncos a las orillas del Lago Titicaca. Recomiendo altamente esta experiencia. Llegamos a aprender cómo las islas están hechas; ver algunas de sus artesanía local; y ver el interior de su césped cabañas (casas).
5,19 octubre 2014,Aguas cristalinas y islas flotantes,"Lago Titicaca está ubicado en más de 12500 pies de altura cerca Puno, Perú y Bolivia y fronteras. Fuimos en coche desde Cusco a Puno cruzar el punto más alto de la autopista donde podíamos ver el glaciar andina y el origen del río Amazonas. Desde Puno, cogimos un barco para poder llegar a las islas flotantes donde los Uros nativos han vivido durante siglos. Hay un guardia de fronteras en una isla flotante; sólo aquellos en un grupo de excursión, o con billetes, puede continuar. Toda la experiencia de aprender cómo estas personas viven y sobrevivir era única y más educativo. En una de las islas, que pasamos aprendiendo primera mano acerca de su historia, estilo de vida y estructura de la familia y habilidades de supervivencia. Aprendiendo sobre ellos era verdaderamente importa boggling y está altamente recomendada para los visitantes a Perú.Turismo apoya y nos complace adquirió varias hechas a mano artículos como souvenirs y regalos."
5,15 octubre 2014,Isla de paz en una excursión agitado,"Lago Titicaca y Uros isla eran tan tranquilo y un sereno respiro en una excursión muy ajetreado. Nos habíamos ido a Machu Picchu, desde Cusco ... que era de 2 horas por combi, 2 en la estación de tren y otra media hora en llegar al sitio. Machu Picchu fue una excursión de dos horas y tomamos otra hora y luego salir del sitio, lo cual es un poco un laberinto. Imagino que la misma cantidad de tiempo para regresar a Cusco y tienes un día muy largo. Al día siguiente fue una excursión en autobús a varios pequeños lugares que tomó durante todo el día para llegar a Puno. El Lago estaba sereno y Reedy y salpicado con pequeñas aves buceando en el agua. Uros isla en sí es en realidad construido enteramente de juncos, así que todo se inclina suavemente flotadores. La guía India hizo una excelente presentación, nos dieron a probar algunos de los juncos que utilizan en su dieta, y la oportunidad de comprar algunas de sus tapices. Nos invitaron a visitar la casa de paja. y mira estos indios tienen paneles solares portátiles que el poder televisión conjuntos en la noche. Quedé impresionado por los juxtapostion de la primitiva y la moderna. Los Uros indios celebrar Madre agua; a diferencia de la mayoría otros indios, que celebran madre Tierra. Esto se refleja en los tapices. Después cogimos un barco en una de sus catamaranes de paja a otra isla que tenía un pequeño restaurante. Pasamos un barco lleno de niños vestidos todos iguales, que pensamos que era un autobús temas de la escuela. La tranquilidad única de Uros isla fue uno de los puntos destacados de la excursión para mí!"
5,10 octubre 2014,Hermoso lago en una elevación alta,"Clear Lake prístino con viento, sol y bahías. La única cosa que falta? Personas. En ningún otro lugar del mundo este lago estaría completo si los barcos y turistas. Originalmente agua de mar. Elevación de las montañas trajo este lago de elevación alta (unos 12,500 pies sobre el nivel del mar) y el agua de lluvia finalmente reemplazado el agua salada para que sea ""Sweet"". Las aves interesantes, fotografía, iluminación tormentas, islas flotantes, Tequille Island (Patrimonio de la Humanidad por la UNESCO) hacen de este un gran lugar para ver. Haga el derroche y estancia en Titilaka hotel donde todas las excursiones están incluidas."
