rating,date,coment_title,coment_description
5,28 octubre 2015,Maravilla Natural,"El vuelo llega a Juliaca y de ahi 45 m a Puno, justo antes de la ciudad se tiene la primera vista del lago, por motivos de trabajo me tuve que desplazar hasta el pueblo de Conima por lo que pude recorrer por la orilla del lago por mucho tiempo, es impresionante."
5,27 octubre 2015,maravilloso lago titicaca,visitar el lago navegable mas alto del mundo a sido un honor las islas rodeadas de montañas los aves la gente de los pueblos son generosos las tradiciones la historia impresionante el guía que nos llevo fue todo un herudito
5,23 octubre 2015,Impresionante,"Estuvimos en el Lago Titicaca en octubre de 2015. Desde Puno salimos en barco. Llegamos hasta una isla artifical donde habitan los Uros. Hay muchas de ellas, son islas de totora totalmente artesanales. Desde allí dimos un paseo en una embarcación también de totora. Es un lugar mágico donde reina la paz y la calma. Al regresar nos dieron una charla explicativa acerca de la construcción de las islas y pudimos adquirir diversos souvenirs. Después fuimos a una isla natural donde almorzamos con una maravillosa vista al mar. Allí se pesca la trucha y la cocinan muy rica. No se debe deja de conocer este lago cuando se va al Perú. Es realmente muy recomendable."
5,22 octubre 2015,Una paz única,"Un lugar increíble con una paz sagrada, recorrer su costa, subir sus montañas para meditar, apreciar sus atardeceres, soñar despierto, lugar donde la paz se detuvo para ofrecer un sinfin de sueños creados."
4,22 octubre 2015,Hermoso lugar,"Es un atractivo que vale la pena visitar. Recomiendo quedarse unas 3 noches para visitarlo de forma tranquila. Sobre el Lago Titicaca se ubica Copacabana, lado boliviano. Excursiones para hacer a la Isla del Sol, Islas Flotantes, Isla de la Luna, El Calvario que es una caminata hasta la cima de un cerro ubicado sobre la ciudad.Las excursiones a las islas se pueden comprar en algunos hostels o sino en las agencias sobre la calle principal de la ciudad.La mejor época del año para visitarlo es de mayo a octubre.Desde La Paz pueden ir hasta Copacabana tomando una van desde el Cementerio de La Paz. El viaje tiene una duración de 3,30 horas."
5,30 septiembre 2015,Un paseo en lancha formidable,"Es tranquilo, aguas limpias, en ella habitan indígenas de la zona, llamados Uros, gente amable, sencilla, cordial y atenta, comparten con los visitantes su modo de vida, así como nos permitieron conocer sus vivienda y pasear en las lanchas que hacen con la planta que ahí crece y sobre la que edifican sus casas."
5,28 septiembre 2015,Fantástica experiencia,"Visitar las islas flotantes donde habitan los ""Uros"", es una experiencia distinta, muy reveladora, increíble en todo sentido, por la sencillez, la simpatía que inspira esta gente, sus tareas, su organización, sus medios de supervivencia. Mucho para aprender, además de lo agradable que resulta todo esto."
5,18 septiembre 2015,Diferente,"Hermosa e inovidable experiencia en Puno, es algo diferente, divertido, lo unico que me ocurrió en mi estadía fue un dolor de cabeza eterno, entiendo que por la presion y la altura, pero despues todo fue excelente."
5,15 septiembre 2015,Inolvidable!!,"Una de las experiencias mas lindas que he vivido, navegar este lago..
Muy emocionante la visita a las islas flotantes, compartir las experiencias y la vida misma de los habitantes de estas islas no tiene precio..
Imperdible.."
1,15 septiembre 2015,Desilusión,"Una gran desilusión la visita al lago Titikaka. Excesivamente comercial todo. Los lugares totalmente deseperados por vender una imagen y sacarle plata a los turistas. Por lo menos del lado peruano el color del agua esta muy lejos del azul que describen en los comerciales y es totalmente marrón. Destino muy lejano de todo y en mi opinión no vale la pena, existiendo otros lugares más interesantes donde pasar el tiempo y gastar el dinero."
4,15 septiembre 2015,Un pequeño desvío antes de regresar ,Increíble visiten taquile y amantani tomen el tour en Puno y no se arrepentirán una experiencia única con familias del mismo sitio que te hacen vivir sus costumbres y más
4,12 septiembre 2015,Lugar hermoso,Es un lugar lleno de hermosura pero la cantidad de basuras y el poco sentido de pertenencia de su habitantes le dan un futuro muy poco próspero que lastima. Por lo que más quieran implanten políticas en la protección de este hermoso lugar
5,9 septiembre 2015,Bello paisaje y rica comida,Divino lugar para pasar el dia y comer unas ricas truchas ! x lo general van en lanchas contratadas que salen del puerto a conocer las islas de totora y luego ya van hacia tierra firme . Es increible que vivan aun en esas condiciones ... como quedados en el tiempo ! llevar abrigo ya que por las tardes refresca mucho y protector solar !
5,7 septiembre 2015,Impresionante sin duda.,"Siempre minimicé los comentarios de las personas que hablaban que el Lago Titicaca era enorme pero la verdad que sí lo es. Se nota que es increíblemente extenso.Desde Puno, que es desde donde lo conocí, recorrí con un par de tours las islas que están ahí dentro. Desde adentro (navegándolo) o desde lo alto en el mirador (vista panorámica) el lago es impresionante. Me ha gustado mucho conocer este destino."
4,6 septiembre 2015,Hermoso lugar! Bastante frio,"En general la inmensidad del lago es un espectáculo hermoso... el recorrido hasta las isla de uros y Taquile, duran más de una hora, aunque las embarcaciones son realmente cómodas. Después de iniciar el recorrido los guías indican que se puede salir a la terraza de la embarcación a tomar fotografías, es recomendable para estos momentos llevar elementos abrigadores."
4,2 septiembre 2015,Sobre el lago mas alto del mundo,Increible que haya gente que viva en el lago mas alto del mundo en islas formadas por cañas totoras que cruzan y descruzan para mantener la formas.
5,1 septiembre 2015,Hermoso reflejo del cielo azul,"Es una belleza de lago, el reflejo del cielo azul de la sierra le da una hermosura imperdible, existen varios tours por realizar tanto del lado peruano como boliviano."
4,1 septiembre 2015,Hermoso,"Hermoso viaje en lancha recorriendo la inmensidad del lago hasta llegar a una de las 87 islas de los Uros, conocer una familia, su vivienda y sus trabajos. De ahí un corto paseo hasta otra isla en una típica embarcación de la zona. Luego almorzamos comidas típicas en la isla de Taquile y luego de una infusión caliente, algunas demostraciones de instrumentos y danzas de los nativos. Había sólo tres hombres y una joven porque los demás estaban en un festejo de un casamiento."
5,28 agosto 2015,Lago Titikaka,"Es una experiencia que no deben perderse nosotros también estuvimos en la isla Taquile es verdaderamente asombroso que estés a una altitud de 3950 msnm y ver como esas gentes tienen su cultura protegida con sus costumbres tan fuertes,vean la fotografía de nuestra comida y la vista del Lago."
5,26 agosto 2015,Tan azul!!,"Hermoso, sereno y gigante Lago, de aguas tan azules que te enamora. Navegar en él es inolvidable, quiero volver y otra vez disfrutarlo"
5,26 agosto 2015,majestuoso,"El lago navegable más alto del mundo, una belleza natural que une dos países Perú y Bolivia. Encuentras en sus aguas islas naturales como Amantani , Taquile y la isla del sol en el lado Boliviano. Las islas de los Uros es una experiencia única en el mundo y hay como 80 de ellas. Este lago es también hábitat de diversos peces y aves.La importancia de este lago también es a nivel histórico porque cuenta la leyenda que los primeros incas salieron de sus aguas formando el imperio incaico .puedes pasear en sus aguas y conocer sus islas porque hay diversos tours."
4,24 agosto 2015,Trascendental,Los uros es una isla flotante que se encuentra en el lago titicaca me encantó este lugar por lo mágico y admirable de sus casas hechas con el mismo material q existe en el lago por las noches corre mucho viento y hace frío
4,21 agosto 2015,el imponente lago titikaka,"Despues de una noche de viaje desde cusco, llegue a la ciudad de puno, mi objetivo es conocer las culturas indigenas del Perú, uno tiene la opción de hacer por su cuenta o tomar un Tour, yo tomé un Tour, al final casi te sale por lo mismo, decidí no quedarme en las islas, es mejor; sólo llegar al lago ya te sientes pequeño con su belleza e inmensidad, realmente no se si llegas a conocer a los ""uros"", ni menos aún si llegas a creer en el guía, el dice los uros no tienen religión ni medicina, yo tengo entendido, con mi corto conocimiento, que todas las culturas creen en algo y tienen medicina, así sea rústica. El guía dice que los uros nunca han salido del lago, pero el ""uro"" que nos acompaño me dice ""estuve haciendo trueque de pescado por papá y arroz"". Como último dato conocí un historiador en Arequipa y me habló del último Uro, una mujer, en la década del 50. Sin embargo, creo que esto hace mas intetesante el viaje, hay que ir al Titikaka, hay que escuchar al guía, hay que dudar, hay que investigar, conocer a los ""Uros""."
4,19 agosto 2015,Merece la pena,Una buena experiencia que merece la pena. Eso si con medio dia sobra. Y no recomiendo coger ni tour ni nada. Directamente al embarcadero hasta el final que se paga mucho menos. No hace falta reservar. Eso si solo salen en la mañana las embarcaciones.Ademas mejor venir de otro sitio de altura si no te quieres marear
4,12 agosto 2015,Muy lindo,"Aunque al principio parece sucio, luego todo se ve muy bien. Las islas de los Uros son interesantísimas y dormir con los aymará fue una experiencia inolvidable. La noche donde escuché el silencio total. Hermoso"
1,11 agosto 2015,Una experiencia de terror,"Nuestra visita al Lago Titicaca, isla de los Uros y Taquile, una pesadilla. Con tanta tecnología no pudieron prever los fuertes vientos. La vuelta anticipada tuvo que retornar a la isla taquiles, la embarcación era sacudida como una cáscara de nuez, no contaba con chalecos salvavidas, ni radio para comunicarse con tierra, desorganizacion total. Mas de 8 hs.sin comer, y fuimos llevados a otra peninsula, a oscuras, con un frio total, con gente descompuesta. Realmente deberían controlar este tipo de embarcaciones!!!! Una pena que los turistas nos llevemos esta impresión del Perú.... Cabe aclarar que esto nos sucedió el día 9 de agosto del 2015. Debiamos regresar a tierra a las 15 hs. teniamos tiempo para recorrer Puno y comprar algunos regalitos, ya que al otro día regresabamos via Juliaca-Lima-Buenos Aires, y estuvimos en tierra, previa subida en la montaña a oscuras, con frio, y hambre, a las 21,30.... muy lamentable"
5,7 agosto 2015,Majestuosidad del Lago Titica zona Peruana,Es incomparable la emoción de ver la majestuosidad del Lago Titica y mucho mas desembarcar en las islas flotantes y compartir con los habitantes indigenas. Otra experiencia es navegar en una canoa hecha de la fibra del lago. Ir bien abrigados.
5,7 agosto 2015,El lago más alto,"Lago mitad Bolivia mitad Perú, lo recorrimos por el lado de Perú conocimos el pueblo indígena que vive en islas flotantes, y una isla llamada Taquile, linda gente, curiosamente los hombres solteras visten diferente a los casados, y si quieres fotos con ellos o con los niños le debes dar soles."
5,31 julio 2015,Admirable...,"Fui a visitar Puno y no me perdí el Lago Titicaca, es hermoso, imponente, majestuoso, hasta romantico y un buen lugar para reflexionar. Las islas son muy coloridas y los paseos en bote, ni hablar, siempre con la vista incomparable."
2,20 julio 2015,Espectacular pero el regreso una pesadilla,"Contraté un tour a las Uros y Taquile con Great Trip Titikaka, el lago en sí es una maravilla, imponente! La gente de las islas a visitar es super amable y que decir de los lugares: hermosos! Una visita imperdible, lo único malo fue que al regreso había mucha marea y no se si por irresponsabilidad o demasiada confianza del guía es que decidió regresar y fue una verdadera pesadilla, la fuerza del agua rompió los cristales del bote en el que íbamos, comenzó a entrar el agua y el capitán se cortó la nariz con el cristal del parabrisas o no se como se llama del bote y fue una verdadera odisea llegar a tierra, sin duda no regresaría jamás, ya que no cuentan los botes con lo indispensable para casos semejantes"
5,15 julio 2015,Imponente!!!,"Es el como el mar en alta montaña...en invierno es muy frio, desde Copacabana Bolivia, es mejor visitarlo que desde Puno Peru, en Puno esta muy sucio, en Copacabana es mas limpio y bello. La vista de la Cordillera de los Andes cuando viajas a la Isla del Sol, es impresionante...sublime."
5,13 junio 2015,Un lugar lleno de magia ,El lago titicaca ofrece una vista espectacular y un acercamiento a la cultura pre incaica que nos acerca aun más a nuestros origenes
5,10 junio 2015,Un hotel 5000 estrellas,"Ver el agua, las montañas nevadas, millones de estrellas, la cultura, buena comida, no tiene comparación."
5,9 junio 2015,Simplemente maravilloso,"Conocer el lago fue una gran experiencia, teniamos muchas ganas de estar ahi y navergar en el, es enorme y ofrece vistas bellisimas."
5,3 junio 2015,interminable,"El lago titicaca, es inmenso, y muy claro, lo mas resaltante fue mi visita a isla de uros, a media hora en bote a motor, los pobladores te reciben con mucho cariño, se puede comer, y comprar recuerdos en las islas, y puedes ir de una a otra."
5,27 mayo 2015,Maravillosamente increible,"Es hermoso navegar por el lago ver las islas flotantes, la manera de vivir de esa gente tan cerca de la civilizacion y tan precaria sin comodidades, sus artesanias en junco son muy bonitas, las canoas hechas por ellos mismos, la tranquilidad del lugar realmente maravilloso"
4,24 mayo 2015,Grande,"Un lugar para dejarse encantar por la historia y por la grandeza de la naturaleza. Es poco desarrollado en cuanto a opciones turísticas y comodidades se refiere pero bueno, esta OK para un fin de semana."
4,22 mayo 2015,LUGAR MISTICO Y CON MUCHA CULTURA,"es un lugar con muchas cosas que ver ya sea con las chullpas de sillustani con su historia kolla y incaica, la islas flotantes de los uros que flotan en el lago navegable mas alto del mundo el titicaca, el tejido de la isla taquile y su turismo vivencia con sus hermosos paisajes y vistas del lago y su folklore en danzas y cultura, exelente lugar para visitar"
5,10 mayo 2015,Deslumbrante,"El lago es espectacular y la experiencia de navegar en el es única.
Es realmente impactante, inmenso y majestuoso."
4,29 abril 2015,ISLA DE LOS UROS,"Espectacular Lago, una gran atracción con una historia fascinante. Se dice que en la época Incaica en el Perú, de allí salio un emperador inca llamado Manco Capac, tienen que leer esa historia, es fascinante."
5,20 abril 2015,Majestuoso,"El solo hecho de estar en el Lago naveglable más alto del mundo ya es una experiencia única. Además el paisaje es precioso y el reflejo del sol sobre el agua le dá un tono diferente que nunca había visto... En abril estuvo demasiado frío, tomando en cuenta que soy de un país tropical... Me encantaron las aves que pude fotografiar. No se lo pierdan!!!"
5,10 abril 2015,Impresiona su inmensidad,"Sorprende desde el inicio la magnitud del lago .... casi un mar a gran altura, la sorpresa esta en cuanto lo navegas ..... no te mareas, al menos nadie del bote se mareo, visitar las islas y su gente es sorprendente, sin lugar a dudas una experiencia inolvidable. También probar las truchas que por la frescura destaca su sabor, ojo, llevar abrigo, la travesía puede alargarse y el frió es notorio."
5,27 marzo 2015,Un espejo para los dioses que no te puedes perder,"Sencillamente espectacular. Sólo los que hemos tenido la fortuna de conocerlo podemos saber lo que se siente apreciar este bello lugar desde una de las islas. Poder apreciar desde una colina este inmenso y serenos mar no tiene precio. Armonía, silencio, inmensidad, energía, paz, tranquilidad. Son sólo algunas de las muchas palabras que pueden describirlo. Si tienes la oportunidad de amanecer y compartir con sus habitantes una o dos noches en una de sus islas no lo pienses dos veces. Extraordinario."
5,25 marzo 2015,Imponente,"Por su enorme extensión, el color de sus aguas y la zona donde está ubicado, es un espectáculo imponente. Si además consideramos a sus habitantes, que indudablemente tienen su propio estilo de vida que es muy particular, es un lugar aún más interesante."
5,24 marzo 2015,"Lago Titicaca, un mágico lugar lleno de energía!!!","Destino totalmente recomendable. Hicimos la ruta regresando de Uyuni, Bolivia. La idea era continuar hasta Cusco. Quedarse en el lago es simplemente una experiencia mágica y calmada.Tomamos la excursión de dos dias con pernocté en la isla Amantani.El primer día salimos en una embarcación bastante cómoda con un techo acogedor ya que estaba habilitado para poder hacer el viaje al aire libre y, aunque el sol era fuerte y el frío del viento llega a calar los huesos, nos animamos a estar arriba viendo el paisaje durante casi todo el trayecto de ida. Es increíble y los paisajes muy bellos.Primera parada, Isla de los Uros. Isla hecha de totora donde nos dan una pequeña charla e interactúas con los habitantes de esa pequeña isla, son como 30 islas pero nos llevan a la que está preparada para recibir turistas y puedan aguantar las fotos y nuestra curiosidad. Venden artesanías y es bonito conversar con ellos. Hablan aymara pero igual nos hacemos entender.Salimos rumbo a Amantani y luego de hospedarnos en la casa de la familia que serán nuestros anfitriones y después de probar comida deliciosa preparada en base a productos de la isla (no hay carne), caminamos hasta lo más alto de la isla, es mágico!! para los que fuimos en plan místico es un lugar hermoso para meditación, la energía es muy fuerte y el atardecer espectacular.En la noche nos deleitan con un show musical muy bonito! y nos invitan a vestirnos por un momento como ellos. Sus ropas son muy coloridas y es muy divertido bailar y transformarnos un poquito en ...ellos. La experiencia es enriquecedora.Al día siguiente dejamos muy temprano la isla para dirigirnos a Taquile, otra isla muy acogedora e interesante. Le dimos la vuelta y almorzamos trucha. Nuevos paisajes. Muchas fotos!!!El retorno es agotador y todos dormimos muy calmadamente en el bote, las olitas nos mecen como a bebés.Es una experiencia totalmente recomendable!!! No se van a arrepentir.Como alternativas en Puno y ganen conociendo más tienen a Sillustani y Chucuito, lugares con historia y muy interesantes! Les recomiendo dejar Puno el mismo día en la noche si no van a salir de la ciudad. Puno no tiene mucho que conocer excepto la calle turística donde pueden encontrar recuerdos lindos y comer pizzas muy ricas!! en este aspecto, son únicas!Les comparto un par de fotos ;)Feliz viaje!!!!!!!!!!!!!!!"
5,14 marzo 2015,increible,"una experiencia hermosa, cada isla tiene su encanto y su cultura... hermosos paisajes, gente amable y educada, comidas tipicas deliciosas....parece un oceano, no un lago... en amantani nos faltaba todo el tiempo el aire, pero con el té de muña pudimos superarlo... nos alojamos en la casa de olga, una chica del lugar, nos cocinaron cosas riquisimas."
5,12 marzo 2015,Espectacular,"El paseo en el lago, el azul de cielo contrastando con las nubes, el reflejo del cielo en el lago, las islas de los uros, es un paisaje bellesimo, una experiencia que definitivamente si se puede hay que vivirla,"
5,12 marzo 2015,Maravilla del Mundo,"Personalmente el Lago Titicaca debio formar parte de las maravillas del mundo, quede encantado con los Uros y la Isla de Taquile"
5,9 marzo 2015,Magico,Aunque he ido desde el 2006 a la fecha en más de 8 veces solo en tres oportunidades he tomado un paseo por el lago a las islas flotantes donde viven familias y tengo fotos impresionantes ya que conversas con familias y cuyos hijos salen en botes diarios para ir al colegio. Hay mucho y buen turismo nacional como internacional. Estas islas son tejidas por los mismos pobladores que viven en ellas. Realmente es una experiencia fabulosa y el entendimiento que sus pobladores son realmente felices en su forma de vivir... Vale mucho darse una vuelta por allí ya que impresiona la majestuosidad del Lago Titicaca.
5,26 febrero 2015,Hermoso!!,"Una visita que vale la pena totalmente!! Ver el Lago Titicaca yq de entrada es una experiencia increíble, y si es posible visitar las Islas flotantes de Uros o Taquile, la experiencia es muchísimo mejor! Recomendadísimo!!!"
4,26 febrero 2015,Una maravilla de la naturaleza,"Hace exactamente una semana atrás estaba en vísperas de viajar a la ciudad de Puno, la cual se encuentra situada a 4,738 s.n.m. Viajaba por motivos laborales a desarrollar un taller de un Diplomado. La verdad que el viaje no me entusiasmaba, la altura el frío, durante la fiesta de la Virgen de la Candelaria había llovido y caído granizo, así que el panorama no era muy alentador. Llegué al Aeropuerto Jorge Chávéz con dos horas de anticipación y el vuelo ya estaba retrasado una hora, salimos con más de una hora de retraso en LAN y llegamos a la ciudad de Juliaca a las 12:40 de la tarde, desde allí hasta la ciudad de Puno 45 minutos pero el transporte turístico hasta que no se llena no parte, es barato S/15.00 por persona. Partimos casi a las 2:00 de la tarde. Conversaba con una pareja que regresaba a Puno luego de 34 años, habían trabajado en una mina de la zona y se habían casado ahí mismo, cruzamos la ciudad de Juliaca y enrumbamos finalmente hacia Puno. Cuando al acercarnos a la ciudad de Puno, ingresó a una curva, se presentó ante mis ojos un espectacular imagen, digna de una postal, el lago encuadrado entre edificios, pero la luz el cielo, las barcas transportando turistas, fue un hermoso espectáculo, ya no importo la altura, no llovió ese día hasta la noche. Realmente vale la pena conocer el lago más alto del mundo y visitar las islas artificiales de los Uros, las cuales espero conocer en otro viaje ya que el tiempo quedo corto. He recorrido un muelle, muy bonito pero descuidado, deberían de conservarlo mejor y mantener una laguna interior que se ha llenado de lentejas de agua debido a la contaminación. No hay mal olor pero el municipio debería preocuparse de la principal atracción turística de la ciudad, este muelle atraviesa desde la altura de Universidad Nacional hasta el barrio Titikaka, así lo escriben los puneños, existen numerosos restaurantes en toldos con precios económicos y en ellos se puede probar la trucha que se cría en la pisigranjas, los sábados hay ferias en donde se puede adquirir de todo, ya que por ser zona de frontera con Bolivia, el comercio internacional informal es una actividad muy difundida. Los quesos que se producen en la zona son extraordinarios, los mencionó, pues la UNA(Univ Nac Andina) los produce en uno de sus centros de producción y los pueden encontrará en el Mercado central a S/17.00 el molde de un kilo. La zona de Melgar cercana al Cuzco es zona productora de ganado vacuno y lanar. Realmente debe ser un bonito viaje llegar a Puno desde la ciudad Imperial del Cusco por el tren. Existen hoteles de todos los precios, a mi me hospedaron en un hostal simpático cómodo y que en la noche por ser zona comercial en el día es silencioso, el Qoñi Wasi (Casa caliente), sus precios son cómodos e incluyen el desayuno, está a cinco cuadras de la plaza de armas frente a la estación del tren y hay transporte público para todas las zonas de la ciudad y las zonas un poco alejadas. Una bonita experiencia, aunque en el regreso otra vez tuvimos problemas con LAN, llegó retrasado casi una hora, y luego tuvieron que hacer mantenimiento a la turbina izquierda, salimos a las tres de la tarde, este vuelo tenía escala en Cusco pero convencieron a seis personas que volaban de Juliaca a Cusco y los enviaban en unas horas en otro vuelo, llegamos a las 4:35 pm deberíamos con escala y todo haber llegado a las 3:15 pm, y se convirtió en vuelo directo; algo pasa con los aviones de LAN Perú"
5,23 febrero 2015,Hermoso!!!,Cada vez que visito el Lago Titicaca me impresiona mas. Esta vez me hospede en la Isla Amantaní y debo decir que es mas bonita que Taquile. 100% recomendable!!
4,22 febrero 2015,Realmente Asombroso,"El lago en su totalidad (lo que he podido ver en la parte peruana) me ha sorprendido bastante. Las islas de los Uros son materia sobre que reflexionar. Pienso que atrás haya una fuerte connotación turística, esto pero no le quita nada al encanto de ver cómo viven la cotidianidad en un ambiente tan hostil. Hay miles de tures que salen a diario en el Lago, yo opté para el tour de un día que incluya las visitas a los uros y a la Isla de Taquile. Sugiero que traigan agua, fruta y el traje de baño.Si esta opinión les ha sido útil por favor aplasten el SI a bajo del texto, gracias."
4,19 febrero 2015,dia de paz,"Hermosa excursion a la islas de los uros, saliendo desde Puno en barco en tan lento como placentero y pacifico trayecto. Azules del cielo y del lago contrastan con las coloridas vestimentas de los niños y de los habitantes de estas atipicas islas.Si bien es muy turistico vale la pena adentrarse y conocer sus costumbres. La verdad que este dia supero mis espectativas"
5,15 febrero 2015,GRAN EXPERIENCIA,"Un tema es ver en videos estos paisajes, pero ya vivir esta experiencia no tiene precio. Visiten la isla de los Uros."
5,13 febrero 2015,Espectacular!!!,Realmente es grandioso visitar este Lago.. te inspira una tranquilidad y relajo total!!! Bello paisaje peruano! I ♡ Perú!!!
