rating,date,coment_title,coment_description
5,13 noviembre 2016,Debe visitar,"El Lago Titicaca es la razón para viajar a esta zona y que tiene mucho que ofrecer. Nos pareció interesante, pero abarrotado Uros con los turistas. Isla Taquile mucho más tranquilo y estupendo para preciosos paseos."
4,13 noviembre 2016,Un buen paseo en barco,"Vinimos desde el lado sur por una hora de viaje en un día soleado, así disfrutamos del paseo y de las vistas. Que aparentemente se pone revuelto más tarde en el día."
5,10 noviembre 2016,Impresionante,"Vale la pena visitar la altitud para un par de días - lago es enorme y absolutamente impresionante, con muchas cosas que hacer (recomiendo una excursión a la isla de Uros y Taquile islas de juncos)."
5,9 noviembre 2016,Siguiendo las tribus perdidas,"Una excursión en barco en el lago recomendado para las tribus de las islas flotantes, Experiencia antropología interesante.
Un poco demasiado turístico, pero dan una idea de lo que era antes."
5,9 noviembre 2016,Inmensa!,"El lago es tan importante como fuente de agua para los habitantes y tiene gran importancia histórica. Vimos piscifactorías, lechos donde aves encuentren refugio y vimos barcos cargados con cañas pequeñas siendo - forraje para los animales de granja.
Un hermoso lugar."
5,8 noviembre 2016,¡Qué experiencia!,"Tomó el día excursión en barco de Uros y Taquile. Las islas de Reed son increíbles y el habitantes locales eran acogedores y presentado casas gentilmente. La caminata en Taquile tomó el aliento (literalmente), pero valió la pena el esfuerzo."
4,7 noviembre 2016,Hermoso,"Un hermoso paisaje. Viaje a las islas flotantes, definitivamente no es necesario. Lugar encantador en un día soleado. El tiempo puede cambiar rápido"
5,6 noviembre 2016,Fantástica,"Visite el lago con mis amigos, tenía un gran tiempo la gente es muy amable y la trucha deliciosa, gracias a la agencia Inti Trail y Emilio"
4,6 noviembre 2016,Titicaca er et debe,"Cuando en Perú, un viaje en el lago Titicaca es un deber. En octubre tuvimos el cielo azul y el sol y la mayoría de los barcos (chek con agencia) tiene la posibilidad de quedarse en la terraza. Nuestro indora"
4,3 noviembre 2016,La mejor lejos de Puno vas,"El lago cerca de Puno es realmente no es nada especial. Las islas flotantes son interesantes, pero no demasiado, y escénico afectado por el turismo. Fuimos hasta la Isla Taquile, que es muy agradable. Tardamos como dos horas y media para llegar allí, aunque hay barcos más rápido disponible. Después de aproximadamente una hora y media, el paisaje comienza a igualar el bombo. Algunos lugares me recordaba al Mar de Cortez. A medida que te acercas, puedes apenas Taquile empezamos a ver las montañas cubiertas de nieve en Bolivia. Sospecho que el paisaje se vuelve aún más dramática a medida que continúe hacia Bolivia. Yo no iría de mi manera de visitar el Lago Titicaca si no tienes tiempo para salir y explorar."
5,1 noviembre 2016,Increíble Blues,"Un gran lago. Tenga en cuenta que el pronóstico será helada, pero de alguna manera es cálido justo después del amanecer y mucho más frías en la tarde. No muy fríos en el agua. Los barcos no rock mucho, y no en todos, si sólo va a las islas flotantes."
5,31 octubre 2016,Una maravilla en sí mismo,"El lago es accesible por barco o privado tour. Disfrutamos viendo su magnitud y teniendo en cuenta su elevación (12, 600 pies). Es claramente un recurso valioso tanto para Bolivia y Perú. Por la historia de la gente, es sin duda un lugar para ver y considerar."
5,30 octubre 2016,Tome el tiempo para hacer un tour,"Alquilamos un barco' para los dos de nosotros para excursión Islas Uros y Taquile. Isla flotante Uros (reed) es más de una trampa para turistas, pero es interesante escuchar lo que 'make esta islas'. Hay 87 islas que conforman Uros. Un guía le ayuda en la explicación de la diversas culturas de la gente.La isla de taquile es preciosa y la historia detrás de su ropa es quizá el más interesante. Son conocidos por la calidad de sus tejidos y tienen la más alta calidad en todas las marionetas de dedo de Perú. Confía en mí, miré a todos lados!"
5,29 octubre 2016,Tonos de azul impresionante,"No sabes que incluso pueden conseguir su pasaporte estampado en una de las islas, sin duda tomar esta con ustedes ya que es una parada en la mayoría de las excursiones. Gente amable - Puede a mano souvenirs artesanales aquí pero no esperes pagar precios de mercado, en el lado que están ayudando directamente a la comunidad local."
4,28 octubre 2016,Increíbles islas flotantes,"Las islas flotantes y la vida de la gente de Uros que viven allí ofrecen una fascinante visión de otro tiempo y estilo de vida. Las islas están protegidas dentro de una bahía, en este gran lago. Era asombrosamente decepcionante para ver la cantidad de basura flotando en el agua hacia las islas motoras aceleraron, llevando el día de cosecha de turistas. El agua estaba sucia pero más en el limpiador al acercarse al lago Tacquile islas. Disfrutamos aprendiendo de las jóvenes acerca de sus artesanías y disfrutamos de un paseo en los barcos tradicionales de la principal isla de Uros, donde había una pequeña tienda y nos vuelve a nuestro grupo. La parada para comer en Tacquile es otro oportunidad comercial y muchos de nosotros había tenido suficiente de la artesanía."
5,27 octubre 2016,Sorprendido por las culturas y vistas,"En un viaje de un día, visitamos la Isla Taquile, una isla y Luquina flotante uros. Qué lujo ver tres diferentes culturas, encuentro gente tan simpática y acogedora, y viendo un trocito pequeño sobre cómo viven ahora, y cómo han vivido en el pasado."
4,27 octubre 2016,Gran lago,El lago en sí se siente más como un océano. Agradable y relajante viaje en barco a las islas flotantes de Uros y Taquile luego desde aquí hacen un gran día.
5,27 octubre 2016,Increíble,"El Lago Titicaca es el lago más alto del mundo navigatable. Pasamos un día en un barco de visitar las islas flotantes de los Uros y Taquile perserve reed. Nuestro 2. Viaje de 5 horas a Taquile fue muy agradable en aguas calmas. Nos encontramos con una tormenta en el camino de vuelta a su hotel y pasamos una hora en aguas ásperas, aterrador. Es un viaje que nunca olvidaré."
5,26 octubre 2016,Qué prístino lago,"Se parecía más a un océano. Cuando empezamos el lago era muy tranquila como el día progresaba, parecía que estábamos en el mar con vientos y olas hubo viento ese bruto. Grande y muy impresionante. Una absoluta debe ver!"
4,26 octubre 2016,Una buena manera de acabar el viaje a Perú.,"Este es uno de los lugares más destacados. . Y debe hacer. . Es increíble cómo, simplemente viven. Gente guapa, así humilde y pragmático."
5,24 octubre 2016,No te pierdas,El rastrillo fue una gran experiencia. Vimos la vida de las personas dejando en las islas flotantes. Me explicaron el camino de crear una isla flotante y tuvimos la oportunidad de ver sus casas por dentro. Era tan agradable sentarse en la isla flotante y de probar el pescado fresco frito. No se pierda.
3,23 octubre 2016,"Es un lago. Es muy grande, pero a un lago.","El lago en sí no es nada especial. El tamaño es bastante impresionante, pero eso es todo.
Hay varios lugares para ver en el lago, como la Isla de los Uros y la Isla Taquile, pero no estoy teniendo en cuenta esto, el lago."
4,18 octubre 2016,Fascinante,"Durante mi viaje de diez días a Bolivia y Perú, mi parada en el Lago Titicaca es uno de los pocos que lamento no porque me decepcionó pero que sólo tienen la mitad de un día para hacer la excursión. Ojalá me hubiera quedado con los lugareños y se dediquen a su vida interesante en estas Isla de Cañas.Aunque la excursión que tenía dio una sinopsis de cómo sus humildes aposentos están segura y segura, y acerca de su vida diaria,creo que sería mejor experiencia culinaria en su mesa.Lo que atrajo mi atención es que no son tan lejos detrás de la tecnología - que tienen sistema de energía solar."
5,17 octubre 2016,Impresionante,"Dimos un paseo en barco a la Isla Taquile y las islas flotantes de Uros. El lago nos precioso, rodeado de montañas."
4,28 septiembre 2016,Debe visitar las islas flotantes!,"Un día de excursión en barco desde Puno para visitar los Uros (Qhas Qut suñi Uru): Las personas que viven en islas flotantes, y Taquileños (habla Quechua) y viven en la isla de Taquile, en el Lago Titicaca. Gente cálida. Sí, es muy turístico, pero estas personas tienen un maravilloso sentido del humor y abierto, su modo de vivir para educar y entretener a nosotros. Nada que hacer en realidad en Puno, pero recomiendo una visita por el lago."
5,28 septiembre 2016,Vale la pena visitar,"A un lago muy bonito. Mejor visitarla cuando no es época de lluvia (de tiempo) porque November-February. Durante la temporada de lluvias hay muy nublado y no creo que el lago es tan hermoso como cuando no hay lluvia.Por supuesto, para disfrutar del lago es mejor coger viaje en barco."
4,28 septiembre 2016,Visita obligada cuando estás en Perú,"Paramos por dos noches en Puno y disfrutamos de nuestra excursión de un día a las islas flotantes y uno de la isla más grande en el lago permanente.Fue muy interesante aprender cómo viven las personas y entender más acerca de sus costumbres locales (especialmente que es individual, comprometido o casado!)."
5,28 septiembre 2016,Como retroceder en el tiempo.,"Compramos un tour a través de Edgar con una fantástica guía local de habla inglesa llamado Saulo. Muy erudito y aprendimos mucho sobre la vida en la isla en las Islas Uros isla amantille así como. Nos alojamos con una familia que nos acogió en su casa y nos cocinó (no hay hoteles en la isla). El entretenimiento nocturno de todos habitantes con los turistas para ese día era un poco surrealista, pero una oportunidad que no debe perderse. Kayak en el lago era agotador, pero exhiilarating taquillen y almuerzo en los grupos de excursión lejos de la con nuestra propia mesa con vistas al lago era como estar en la costa de Amalfi hace un siglo (imagino). Si escuchábamos un grupo turístico de este viaje se puede sentir un poco artificiosa, pero la agencia de aventura (Calle edgar lima) hizo a medida y bien merece la pena."
5,27 septiembre 2016,Increíble lago,"Increíble lago, tan grande, que parece un mar! Las vistas y el paisaje son geniales. Lo mejor que puedes hacer es tomar un barco desde Puno y visitar las islas flotantes de Uros, Taquile y Amantani luego quizás. Vale la pena una visita."
5,25 septiembre 2016,Un escape de alta altitud,"Recorrimos la isla de Uros y la Isla de ambos. taquile Tanto la pena visitar aunque tienen caracteres distintos. En un día soleado, fue una maravillosa excursión."
5,23 septiembre 2016,Debe ver!,Este fue un hermoso lago. Nuestro guía wS pudo explicar dónde estábamos en el lago y donde el lago fuimos. Es un enorme lago. Estábamos al final de la temporada seca pero dijo en la temporada lluviosa será al menos cuatro pies más alto. El viaje fue muy sencillo así que no estaba enfermo.
5,22 septiembre 2016,Hermoso lago con la cultura fascinante,"Visitamos el Lago Titicaca con Edgar aventuras. Fue impresionante ver la cultura y la gente de la isla de taquile y a aprender de su estilo de vida. Las islas flotantes de Uros son diferente a todo lo que habíamos visto. Fue increíble para aprender cómo están construidas y mantenidas. En general, la belleza y la extensión del lago es increíble. Estamos contentos de que nos tomamos el tiempo extra para venir aquí durante nuestra visita a Perú."
5,20 septiembre 2016,Aguas de un precioso azul frío Titicaca,"Día magnífico, con un paseo en barco de ocio para visitar diferentes lugares en este lago más alto, que comparte una frontera natural con Bolivia. Los picos de nieve de Bolivia están visibles en la distancia. Las tribus son habitantes de único este lago."
4,19 septiembre 2016,Sin duda hacer un tour del lago a Uros y Taquile si hace buen tiempo..,"Pasamos un día en el Lago Titicaca, visitando las islas flotantes de Uros y reed luego hacia la Isla Taquile para el almuerzo.Las muchas islas (96?) constituyen la zona de Uros, y es sin duda vale la pena el viaje para ver cómo estas folk viven en 'islas flotantes'. Una agradable experiencia cultural con una buena explicación de cómo las islas de hecho flotar, así como una oportunidad para recoger algunos buenos recuerdos a un precio razonable.Horas más crucero (barco muy lento!) nos vemos en la isla de Taquile, desde donde se puede ver la distante Bolivia. Una vez más una gran experiencia cultural, con una razonable comida para 20 soles.Permitir un día completo como el barco llega de vuelta en Puno alrededor de 17:00, después de la recogida (7.00)."
4,19 septiembre 2016,Interesante Isla flotante,"Tenía un viaje de un día y se trajeron a la isla flotante de donde tener recuerdos hechos a mano, con precios razonables, sin embargo usted puede negociar un precio mejor. Buena para ver cómo viven allí."
3,18 septiembre 2016,Ciudad y barcos lentos; hermoso lago,"Mientras que el lago es precioso, hay poco que ver en Puno. Las islas flotantes de Uros eran interesantes, y vale la pena un viaje de un día, si uno está ya en Puno, no estoy seguro de que recomendaría viajar a Puno a visitar Titicaca y las islas de los alrededores. Visitamos varias islas en el lago, y acordó las líneas de Nazca podría haber sido un mejor final para nuestra aventura Camino Inca. Probablemente la peor parte de Titicata (excepto el polvo y gases de escape en la ciudad) fue la que embarcaciones turísticas son exageradamente lento."
5,14 septiembre 2016,"La isla de taquile es muy interesante culturalmente, se puede decir que es","La isla de taquile es muy interesante culturalmente, puede saber si está casado o tener una sola prueba de su vestido de matrimonio, lo mismo que si alguien es ha sido un líder de la comunidad. Menú de 20 sol en un restaurante de Los Ángeles."
3,14 septiembre 2016,Total trampa para turistas,"Nuestro Tour Lago Titicaca comenzó con una visita a los Uros las islas, que son interesantes en que son islas flotantes, pero horrible en toda la experiencia que se siente obligado y de alguna manera falsa. Estás allí, el desfile traído gente y probar indígenas para llegar a comprar regalos caros. Ellos cantan y bailan y saludar al llegar y todo parece tan forzado y falso.Más tarde, visitamos la isla Taquille y, de hecho, tenía que pasar la noche allí. Una vez que el sitio era genial todos los turistas a la izquierda. Pasar la noche con una familia local fue la mejor parte del viaje. El alojamiento era agradable - nuestra propia habitación con una cama y un pequeño cuarto de baño compartido, pero sin ducha. Un día sin ducharse, no fue un gran problema después cogí el camino Inca y desaparecido cuatro días sin una.De todos modos, si estás en la zona, bien para una visita, pero para mí, no vale la pena desde Cusco."
3,11 septiembre 2016,Un lugar muy tranquilo,"El lago en sí es tranquilo y bonito, azul claro, pero es un poco sobrevalorado, y llena de turistas."
2,11 septiembre 2016,Totalmente sobrevalorado,"Por desgracia nada bueno que decir sobre el Lago Titicaca. Realmente no sé por qué tantas personas ir a Puno, realmente está sobrevalorado. No consigo decidir si su explotación o no pero el viaje en el barco a las islas reed está seriamente de risa si no fuera tan grave para el probablemente las personas que viven allí.Literalmente decenas y decenas de barcos de cola cada día a los turistas crédulos a ferry un par de las islas. No me malinterpretéis, las islas deben tener una fantástica historia y merece la pena ver de primera mano, pero estás literalmente obligado a comprar recuerdos y sólo ver un par de islas y no dejaron ir a ningún otro sitio.. tal vez hay otras excursiones en barco no sé. Fue así que por suerte para mí me tomó mi cartera, no tenía ni idea, solo pensé que íbamos en un paseo en barco por el lago! Todas las cosas que venden en las islas es, por supuesto, las mismas que lo que ves en cada puesto por todas partes, las bandas de la amistad, cojín cubre, bufandas, etc.., beanies Todo es bueno, pero después de los primeros 100 puestos del mercado que tipo de buscar algo un poco único.Lo siento por la mala crítica pero me pareció que todo una decepción y seriamente la lucha de entender porqué Puno es muy popular entre los turistas. Por lo que vale la pena el paseo en barco real está bien, tuve la suerte de tener una hermosa mañana, así que yo estaba arriba tomando sol en la terraza."
4,9 septiembre 2016,Islas Flotantes de Uros,"Las islas flotantes eran totalmente la pena. Muy interesante. Tome el paseo opcional en barco reed. Lo malo - me sentí muy presionada a comprar caro recuerdos"" para ayudar a las familias en la isla""."
5,8 septiembre 2016,Increíble,"Grande, aguas azules. Muy tranquilo, sin ruido de aviones, con muy poco ruido de los automóviles. En la noche oscura, genial para ver las estrellas y ver la cruz del sur si, re suerte (Mejor abril para eso). Hoteles sur de Puno tienen una vista mejor y son más tranquilas. Muchas aves, yendo a las islas flotantes y tequila son una experiencia única en la vida. No se puede perder."
4,3 septiembre 2016,Interesante excursión,"Vale la pena hacer una de las excursiones en bote a las islas flotantes y a la tierra de las islas. Increíble ver la forma de vida en un lugar bastante remoto.Se llevará todo el día y está muy caliente, así que tome un sombrero y agua."
3,3 septiembre 2016,Más de atracción turística clasificado,"Aunque disfruté la visita de Puno y el Lago Titicaca desde Cusco, me sentí como las críticas que había leído sobre lo que eran más exageradas. Está muy orientado al turismo. Me gustó la Isla Taquile la mejor, pero sólo porque me caminaron hasta la cima y las vistas de las profundas aguas azules eran una maravilla. Fui con un grupo de excursión a la Isla de Uros y Taquile luego. Me quedé muy decepcionado con la isla de Uros, ya que nos mostró donde vivían y cómo la construcción de las islas (que me gustó) pero luego me di cuenta de la gente de Perú que gente que ni siquiera viven en la isla de Uros ya. Intentaron llegar a comprar allí las cosas, que entiendo que quieren su dinero, pero que ya habíamos pagado por el tour y me hizo muy incómodo. Si tienes tiempo, fue un frío lago para ver, pero no siento que me falta algo si no ir."
5,3 septiembre 2016,Parece que el océano,Viaje a Islas Flotantes de Uros y Taquile Isla de. El agua es hermosa azul. Gran viaje proporcionado por Perú por menos.
5,1 septiembre 2016,Backflip en el Titicaca,"Viniendo aquí, mi objetivo era volver flip off el barco a este lago. Frías aguas. Muy fría, así que solo lo hizo 3 veces.. Los telones de fondo excelente para fotos, y las personas que viven en las islas flotantes dejando en ti en admiración. Sin duda, este lugar ha escrito todo lo majestuoso."
4,30 agosto 2016,"Agua tranquila, con bellas vistas.","Mi mejor la vista del lago era en Sillustani, pero también el viaje de un día a Uros y Taquile eran muy interesante y agradable."
5,30 agosto 2016,Visita de la isla flotante de juncos,"Visitamos una isla flotante en reed donde viven lago Titicaca algunas familias tribales. Nos mostraron la vida tradicional en una isla y cómo construir una nueva isla. Cuando tengan una mayor conflicto, le cortaron la isla y divide."
5,30 agosto 2016,El lago navegable más alto del mundo!,"La experiencia de viajar en este grande, hermoso lago es simplemente genial! Disfruté de un agradable paseo en 48°F en un barco en 12.500.fasl (3800) de la ciudad de Puno MAMSL a la islas flotantes de Uros y Taquile Isla de."
4,28 agosto 2016,Visitamos la isla baja familia tribal reed,"Esta familia tribal en vivo en la parte superior de la isla de juncos de Cañas y aunque es una tradición morir lentamente como las generaciones más jóvenes están prefiriendo ir a la ciudad, fue una gran experiencia de aprendizaje sobre cómo vivían."
5,27 agosto 2016,Gran Tour,Hicimos una rápida excursión en barco del lago con visitas a Islas Uros y Taquile. Recomiendo encarecidamente este tour con una fascinante mirada a la vida en la isla local.
4,26 agosto 2016,Una visita interesante!,Visitamos las islas flotantes de Uros en el Lago Titicaca - sin duda algo diferente y vale la pena visitar si tienes tiempo.
5,24 agosto 2016,Simplemente hermoso!,"Después de ver Puno nos sentimos preocupados sobre nuestra decisión de viajar todo el camino para visitar el Lago Titicaca. Sin embargo, en el momento en que vimos el lago y subimos al barco a los Uros Islas decidimos que merecía la pena el viaje. Tomó muchas fotografías. Sin duda merece la pena una visita."
4,24 agosto 2016,"Gran experiencia, pero advertencia...","Hicimos el 2D/1N viaje a Uros Amantani Taquile //comprarlos directamente en la estación de autobuses. Primera advertencia: debe ser de aproximadamente 100 soles (10%) + -/pax y comprobar que el Último almuerzo está incluido.Primera parte es Uros, un gran paisaje pero demasiado turístico, la gente es amable pero tratando demasiado de vender la mano de artesanía ""hecha"". Si quieres tomar el barco local"" ""Saber que s10 s/extra (nuestro guía ""se olvidó"" de precisión).La isla de taquile es genial, hermoso pueblo, gente agradable. La familia nos hospedamos con un hogar acogedor y muy amables. Por la noche de fiesta divertido llevar ropa local (suena un poco, pero aún así muy agradable touristtrap). Los faros de estos 2Amantani: paisaje bonito D. así; que el almuerzo en el restaurante está incluido (nuestro guía ""se olvidó"" de nuevo a esta precisa).En general muy buena experiencia aparte de la injusticia de nuestro guía. Lo recomendaría!"
5,23 agosto 2016,Esplendido!!!,"Este fue el punto culminante de nuestro viaje a Perou!!!Es exactamente cómo nos imaginamos un lugar hermoso en el fin del mundo, pero en realidad es donde el mundo empezó...Titicaca está situado entre Bolivia y Perou y es mucho más que bonito...Todos los días se puede visitar diferentes islas con gente auténtica de la región trabajando en ellos como por ejemplo lagente de Taquile es muy, muy amable y la comida es simplemente fantásticaes un lugar para descubrir en pierdas Perou yo recomiendo a todo el mundo yendo allí!!!"
5,23 agosto 2016,Sereno.,"Un gran paisaje y muchas islas para visitar, sino también un lugar agradable para relajarse y disfrutar de la vista."
5,23 agosto 2016,La EXPERIENCIA DE LA VIDA,"Simplemente tomar un paseo en barco por el Lago Titicaca, el lago navegable más alto del mundo, es una experiencia increíble."
4,22 agosto 2016,Isla flotante con su interesante.,Atractivo de gran altitud lago. Islas flotante único e interesante. No hay mucha presión para adquirir artículos de los residentes. Disfrutamos comprando un paseo en sus barcos hechos a mano.
5,21 agosto 2016,Tan hermoso,"Bien vale la pena el viaje desde Cusco, pero me gustaría pasar más tiempo, por ejemplo, estancias de una noche, en vez de Islas en un viaje de un día, aunque nuestro viaje fue particularmente bien con otros grupos no a la vista."
5,11 agosto 2016,El lago es más grande de lo que imagina,"El lago es precioso y lleno de aves, que es un interés de mina. Tardamos 2 horas en llegar a la Isla de Tequile, así que asegúrate de tener un montón de tiempo."
5,11 agosto 2016,Imperdible,El lago es limpio y completamente sin polucion de vida salvaje. Las islas eran interesantes culturalmente único. Una de las mejores cosas en Perú.
5,10 agosto 2016,Deep Blue,Es un lago o el mar es un? El más profundo azul que te puedas imaginar en el medio de la cordillera de los Andes. Prepárate para el alto y tomar tantas tiempo necesario para apreciar la belleza
4,9 agosto 2016,En las cañas gran aves,"Alquilamos un barquero para llevarnos lentamente a través de las cañas buscando aves. Había un montón de garzas, patos, flamencos, rieles, etc. y un espectacular diminutas aves apropiadamente llamado ""muchos tirano cepillo de color"" que era muy común y accesible. Después, el barquero nos llevó a su casa en una isla flotante, que fue reed fascinante."
5,8 agosto 2016,Día maravilloso,El lago es precioso pero alta y fría. Tome capas para los barcos y les tira como en calor. Cuidado con el sol es muy fuerte.
5,8 agosto 2016,Hermoso lago,"Pasé tiempo en ambos lados del Lago Titicaca - El Peruano y el boliviano - y también en la islas flotantes de Uros, Isla Taquile y la Isla del Sol. Es un precioso lago, en su mayoría sin polución. Me encantó y sin duda volveríamos."
5,7 agosto 2016,Grande y alta justo lo que me gusta en un lago,"Ningún viaje a América del Sur está completa sin ver este lugar icono. El lago es enorme y fue maravilloso ver en última después de leer acerca de como un niño. Vi por primera vez de Copacabana, pero nuevamente desde Puno, en Perú. Cada vez que me mostró un lado diferente de sí mismo y siempre con los imponentes nevados de los Andes como telón de fondo. Lo que tienes que hacer es -, paddle wade, tomar un barco, o simplemente pararse y todo bien. No te lo pierdas."
