rating,date,coment_title,coment_description
5,1 septiembre 2014,"De lejos, el mejor que se puede hacer en Puno",Vale la pena reservar una gu칤a para Sillustani como un mont칩n de peque침os (pero interesante) cosas no est치n siendo explicado en las se침ales. Nuestra gu칤a era muy apasionada y nos dejaron tiempo libre para descansar un poco y tomar fotos. El paisaje era extraordinario y muy impresionante (m치s hermosa de la Isla Taquile). Paramos tambi칠n en el Puma Mirador en la manera de Sillustani y en el camino de vuelta nos llev칩 a una casa de Quechua para unos 15-20 min. Muy entretenido y vale la pena las 35 soles (todo el viaje empez칩 a las 2 p.m. y el conductor del autob칰s nos dej칩 en la Plaza de Armas a las 5.30 p.m. ).
5,22 agosto 2014,conocida joya,No hay muchos turistas pero deber칤an ir aqu칤. La zona alrededor de una hora de Puno tiene una importancia hist칩rica. Un paseo de 10 minutos a una fila de souvenirs y ropa se destaca lo lleva a una subida de 10 minutos por un sendero serpenteante donde su gu칤a explica las pre-inca inca y tumbas de las civilizaciones. La circular estructuras est치n distribuidas en 100 acres (aprox.) y mostrar el avance de edificio t칠cnica. Una vez en la cima de la colina 20 metros se te da la bienvenida con el logro ... una circular 10 metros alto tumba inca que nunca fue terminado. Varios cerca han sido re-construido y mostrar lo que parec칤a que en el tiempo. Los bloques de piedra en forma con la calidad de Sacsayhuam치n o cualquier otro palacio real inca. Tambi칠n desde la zona elevada se puede contemplar un hermoso lago de un acantilado y ver la reserva natural de la isla donde unos 80 vicu침a se mantienen. Recomiendo este viaje de medio d칤a a todo aquel que est칠 interesado en la historia peruana particularmente c칩mo los difuntos enviado a la pr칩xima Jornada mundial. Pero conseguir una gu칤a como la informaci칩n en el lugar es m칤nimo y un gu칤a puede decir mucho acerca del lugar que usted no puede leer o averiguar por su cuenta.
5,13 agosto 2014,Excursi칩n de medio d칤a impresionante de Puno,"Este es un gran viaje de medio d칤a desde Puno (puntos de recogida m칰ltiples)Nuestra gu칤a era capaz de ilustrar el hist칩rico significativo con facilidad en varios idiomas.Las vistas desde arriba son espectaculares. Llevar unas cuantas soles para fotos! (habitantes)Me pareci칩 que la calidad de los vendedores de ser bueno, aunque los precios un poco m치s altos que los de otros lugares.Esto cuesta unos 30 soles con - gu칤a de transporte. Tambi칠n nos detuvimos en una granja de cerdos de Guinea en el camino a casa con muchos alpaca y aprendido mucho sobre su estilo de vida y la dieta de la zona.Nota: dej칠 mi bolsa de c치mara en la superior y tuvimos que salir corriendo atr치s para que, gracias a todo el mundo en mi grupo para esperar! Mucho Gracias"
4,8 agosto 2014,"Excelente para la fotograf칤a, un mont칩n de a pie!","Est치 a un corto trayecto en coche de Puno, y el operador tur칤stico se suele tener uno o dos importantes paradas en el camino, en un local farm alpacas o algo as칤. Llegamos a gusto queso fresco de alpaca y que era bastante algo!El lugar en s칤 es estupendo, bien conservado, pero necesita una buena gu칤a para realmente entender nada, ya que no hay se침ales en ingl칠s. Abundan las oportunidades para incre칤ble fotograf칤a, especialmente si puedes tiempo su visita a cerca del atardecer."
4,5 agosto 2014,Titicaca Travel ofrece una excursi칩n muy interesante!,Fue genial ver las extra침as tumbas esculpida - y nuestro gu칤a era fant치stico explicando todo lo que nosotros. Hasta nos detuvimos en una casa tradicional en nuestro camino de regreso a Puno o una peque침a lecci칩n interesante en la vida tradicional Boliviana.
5,5 agosto 2014,Misticismo y aislado,"Visitar las tumbas requiere subir un poco pero el esfuerzo vale la pena. Tendr치 una gran vista del paisaje y el lago en la parte trasera. Las tumbas s칤 son otro ejemplo de arquitectura ingeniosa , desarrollada."
4,28 julio 2014,necr칩polis altitud con ruinas interesantes y vistas fant치sticas,"Una cosa que usted apreciar치 en esta altitud la subida gradual del camino hasta la cima de la colina. bajando, hay unos pasos m치s directas, pero les gustar칤a ser un desaf칤o en torno a 13,000 pies. El viaje en coche es bastante pintoresco, el a츾츽춿n as츾춼, del sitio es atractivo, hay un bien situado restaurante con vistas estupendas (no comimos all칤, as칤 que no puedo opinar sobre ello), y cuando llegue a la cima, se sorprender치 por la magn칤fica vista de un lago escondido con un centrail isla abajo.En general, bastante agradable excusion en camino de Puno en el ""crazy-ciudad"" de Juliaca para el aeropuerto.Adem치s, las viviendas tradicionales de piedra junto a la carretera como su enfoque son bastante interesante y pintoresco."
4,27 julio 2014,Sitio hist칩rico fascinante,El sitio archiological muy bien conservada con pre-Inca e Inca torre tumbas. Tambi칠n podr치 visitar una granja tradicional en el camino de regreso a Puno
4,24 julio 2014,Excursi칩n agradable a las ruinas,"Nuestro primer d칤a en Puno, viajamos a Sillustani y disfrutamos de la visita a las ruinas. Aunque yo no dir칤a que fue algo que no debe perderse, si tienes tiempo, vale la pena visitar."
4,21 julio 2014,Gracias a nuestro gu칤a!,"Ts son las tumbas mejor conservadas desde el pre-inca, inca per칤odo cerca Puno. para nosotros fue la escapada perfecta en nuestro camino a la ciudad. Recomiendo alquilar un gu칤a para obtener el panorama completo."
4,19 julio 2014,"Interesante tumbas incas, hermoso paisaje","Las tumbas Inca eran interesantes, el lago y el paisaje era muy bonito, pero la escalada a unos cientos de metros cuando la altitud es ya m치s de 4,000 m es muy dif칤cil!"
4,6 julio 2014,Vale la pena visitar,"Disfrutamos de nuestra visita a ver las torres, leer sobre la historia. Es un sitio bastante agradable, pero tengo que admitir que las aldeas de atun Colla vecina, donde puedes pasar la noche con una familia local, realmente atrajo mi atenci칩n."
4,3 julio 2014,Gran experiencia con una buena gu칤a,Un bonito lugar en el camino a Puno de Colca Canyon. Agradable descanso en la tarde. Definitivamente vale la pena una visita.
5,2 julio 2014,par fascinante de horas.,"Si te gusta la historia y arquitectura Inca, y su gu칤a conoce su negocio, es un buen viaje. Fue para nosotros una forma de llenar tiempo antes de ir al aeropuerto."
4,2 julio 2014,"Ruinas fascinante, con vistas panor치micas","Aparte del hecho de que ten칤amos bastante peculiares gu칤a tur칤stico que ten칤a algunas ideas filos칩ficas y religiosas interesantes; la excursi칩n de Sillustani fue una agradable sorpresa al salir de la zona de Puno. Las ruinas funerarias son bastante 칰nico en forma y arquitectura, pre-data los Incas, y la zona es elevada con unas encantadoras vistas al lago. Vale la pena una visita."
3,1 julio 2014,Interesante si tienes alg칰n tiempo,"El sitio es interesante, pero lejos de ser la atracci칩n en Per칰. digamos que si tienes unas cuantas horas es bueno ver. Si no no es un drama si te saltas. Tuvimos una buena gu칤a y explicaciones eran interesantes. Hay tambi칠n escrito explicaciones en las tumbas principales, tanto en ingl칠s como en espa침ol. El mercado t칤pico de turistas en la entrada del sitio. Aqu칤 encontrar치 las peque침as vacas que puedes ver en la mayor칤a de las casas de la regi칩n."
4,26 junio 2014,Bonita experiencia temprano por la ma침ana,"Fuimos a Sillustani temprano por la ma침ana en 2013 Julio cuando niebla por la ma침ana era simplemente levantando desde los campos y las heladas aguas calientes alrededor de la pen칤nsula. Recomendado! El lugar tiene su propio aura especial por la ma침ana, como una catedral."
3,20 junio 2014,Simplemente correcto,"No mucho aqu칤 adem치s la tumba/torres e incluso no son terriblemente impresionante. Si tienes que elegir, esto se podr칤a omitir. Las vistas son estupendas aqu칤 pero despu칠s de mucho caminar sin verdadero regalo."
3,19 junio 2014,Otra manera de ser enterrados,"Nuestro viaje por Per칰 y Bolivia parec칤a ser incorporando tumbas, las catacumbas, y un sinf칤n de lugares y t칠cnicas para el entierro. 칄sta fue otra, aunque 칰nico. Una pareja interesante de pasar horas paseando por las estructuras de entierro. Un punto negativo fue que nuestro gu칤a nos pas칩 a ser un poco densos, tanto en ingl칠s como en espa침ol. Despu칠s de la tercera Conferencia en espa침ol que no pod칤amos entender, comenzamos a pasear sin 칠l. Mejor si puedes conseguir un gu칤a que habla su idioma."
4,6 junio 2014,sorprende,"Este fue un lugar donde yo estaba aprendiendo m치s de lo que me esperaba, los incas eran una gente incre칤ble.
Un viaje de un d칤a en autob칰s, hostal propietarios puede organizar para usted"
5,6 junio 2014,Inolvidable,Sitio Sublime y notables monumentos. F치cilmente accesible desde Puno por excursiones diarias o alquilar un coche. El lugar es inquietantemente tranquilo y su ambiente inolvidable.
4,5 junio 2014,Un hermoso lugar para recorrer,Ten칤a un buen tour organizado por el hotel Libertador. Es un hermoso lugar para visitar. Recomiendo tomar un par de horas para ver y visitar los vendedores.
4,2 junio 2014,Viento antiguo sitio de entierro,"Sitio arqueol칩gico de Sillustani es una f치cil excursi칩n de medio d칤a de Puno. Las excursiones salen a las 2 pm y las 5 pm regreso. El sitio es realmente expuesta en una colina junto al lago Umayo, as칤 que tienes que vestirte c치lido. Lo que ves son un n칰mero de torres salas funerarias construidas por la Colla personas, cientos posiblemente miles de a침os antes de los Incas. Las torres cil칤ndricas llamado Chullpa tienen entradas bajas todos con vistas. restos humanos se encontraron en cada uno de ellos, acomodado en una posici칩n fetos. Uno todav칤a tiene una rampa que conduce a 칠l, lo cual indica c칩mo nos hicieron. La zona es propensa a rayos debido al alto contenido de cobre en el suelo. Algunas torres ha sido destruida durante las tormentas. Se siente enfoque un poco de miedo tambi칠n si est치s all칤 y ver치 una tormenta. En el viaje de ida y vuelta, busque flamencos y algunos edificios muy r칰sticos de granja, con vacas cer치micas en su tejado."
5,31 mayo 2014,Sillustani,"Este fue un sitio interesante, y nos quedamos muy contentos que decidimos ir all칤. Est치 a una hora de Puno hacia Juliaca. Las vistas por el camino era precioso, as칤 que el tiempo pas칩 r치pidamente. Este sitio es un lugar donde uno puede ver las torres del entierro de la gente Colla, un grupo que vivieron en esta zona antes de la llegada de los Incas. Que enterrar a sus muertos en ""Chullpas"" que son estos torreones cil칤ndricos gigantes de piedra que est치n muy bien dise침ados. Nunca hab칤a visto algo as칤! Uno tiene que subir hasta el sitio. Se considera el altiplano que es alto, ventoso y fr칤o. As칤 que prep치rate!"
4,29 mayo 2014,Me encant칩 este lugar!,Nos detuvimos aqu칤 en el camino de Juliaca en Puno. Es simplemente precioso!! caminar a trav칠s de un peque침o mercado en una colina a estas necr칩polis que tienen los mont칤culos funerarios m치s interesantes cono en!!! La zona est치 rodeada de un hermoso lago peque침o y es muy tranquilo y silencioso. Vimos una vicu침a de beb칠 en principio ser atendidos por un peque침o Chola. Me alegro de haber parado! Cuando reserves tu excursi칩n merece la pena.
5,28 mayo 2014,boda/ de caminata de ma침ana chapoteos en Educativa,caminata por la ma침ana perfecta. Merece la pena la subida gradual para comprender la historia de la zona. vista del lago vale la pena el esfuerzo. Vista de los agricultores locales/pastores en acci칩n. Encontr칠 una celebraci칩n de bodas local al final de la caminata. La gente era muy amable y acogedor y generalmente satisfechos gente! Bailamos y celebran con ellos como nos enteramos sobre sus costumbres de boda. 춰Qu칠 delicia incre칤ble! Mejor memoria
5,28 mayo 2014,"Un peque침o sitio arqueol칩gico, bien merece una visita",Aunque esto es una hora en coche de Puno y por normas Andinas un peque침o sitio vale la pena una visita. Las torres funerarias (Chullpas) era fascinante.
4,28 mayo 2014,Caro subir,"Para llegar cerca de las Chullpas, tienes que subir bastante altura mediante elevados y 치speras, irregulares escaleras. Muy inadecuado para la tercera edad. Tienes que tomar un tour organizado de lo contrario te dejan colgado como Puno no tiene un servicio de autob칰s p칰blico pero el mismo principio se aplica a la totalidad del Per칰 donde usted no puede viajar por su cuenta."
4,27 mayo 2014,Gran excursi칩n,Este lugar es una tierra de entierro de inca. Me pareci칩 que el gu칤a a ser muy informativo. La zona es una caminata f치cil con un gran paisaje y arquitectura. Mientras estuvimos all칤 una manada de alpacas vinieron y fue incre칤ble.
3,23 mayo 2014,antiguas ruinas medias,"La ubicaci칩n hace que este lugar sea especial. Las tumbas son parcialmente arruinada y as칤 que no hay mucho que ver. Tambi칠n hay dos peque침os 'templos' (uno para el sol y la otra a la luna) que son una sombra de lo que debe haber sido.Hicimos este viaje en nuestro 칰ltimo d칤a en nuestro camino al aeropuerto, as칤 que fue un buen 'temporales"" y muy apreciadas pero no volver칤a especialmente ya que es bastante remota y no un mont칩n de inter칠s para ver una vez all칤."
5,19 mayo 2014,Historia incre칤ble en un espectacular entorno natural,"Los hermosos y llamativos Chullpas de Sillustani son hermosa experiencia de senderismo. Callejeando por este sitio es como caminar hacia atr치s en el tiempo. La interpretaci칩n paneles est치n razonablemente bien hecho y dar un buen sentido del lugar, pero las torres hablan por s칤 mismos. Adem치s, las marismas y el lago volc치nico rodeado del sitio son muy hermosas. Incluso si no eres un aficionado a la historia, el entorno natural merece la pena el viaje. Vinimos a 5 metros de un americano Kestrel (peque침a Falcon)."
3,18 mayo 2014,No vale la pena la caminata,"Ok, as칤 que no soy un aficionado a la arqueolog칤a. Interesante, pero en este punto es un grupo de piedras que est치n en un estado de desorden en gran medida. Est치n trabajando en el sitio, y no disminuye su importancia, pero a menos que realmente me encanta arqueolog칤a no vayas."
5,13 mayo 2014,Espectacular,"Ruinas de bien, vistas impresionantes, y no hay multitudes cuando visitamos. agradecidos por paseo explicativo se침ales en ingl칠s tambi칠n."
5,13 mayo 2014,Lo m치s destacado de Puno,"Nos gusta la historia y este era un sitio muy inusual. Las tumbas son muy impresionantes.
El lago en el lado es muy bonito
Si cerca Puno, es una visita obligada."
5,10 mayo 2014,Impresionante yacimiento arqueol칩gico,Me gust칩 el entorno y monumentos 칰nicos. Muy interesante pueblo peque침o y 칰nico pa칤s casas de camino hacia Silustani.
5,3 mayo 2014,Sillustani - Juliaca traslado de Puno,"Volamos a Juliaca en nuestro camino a Puno para visitar el Lago Titicaca. Utilizamos 'All Ways Travel"" como nuestro modo de traslado desde el aeropuerto hasta nuestro hotel en Puno y porque tambi칠n se combinan con una excursi칩n a/de Sillustani en el camino. vali칩 la pena. 칄ramos los 칰nicos dos personas en el traslado, as칤 que ten칤amos el minib칰s para nosotros, el conductor y nuestro gu칤a Elian. Elian result칩 ser una de las mejores gu칤as que hemos tenido en las numerosas excursiones que hemos tenido. 칄l era amable, agradable, bien informado sobre el pa칤s, la cultura, la historia y la agricultura y ganader칤a de la zona. Sillustani est치 justo a la salida de la autopista (5-10 minutos) en el camino a Puno. Las Mammoth funerario de las tumbas pre-incas habitantes es impresionante. Es incre칤ble c칩mo las piedras cortadas a encajan en una partida, forma de olla de flores (no hay cemento). El paseo por el sendero pavimentado desde el aparcamiento es un poco sorprendente, ya que es de 4.000 metros sobre el nivel del mar, pero Elian tom칩 su tiempo con nosotros y nos detuvimos en muchas de las tumbas de explicar todos los detalles y la historia. El paisaje merece la pena. Tambi칠n nos detuvimos en visita a un representante agr칤cola familiar, donde padre explic칩 c칩mo todav칤a se usan viejo estilo herramientas de mano hasta sus peque침as parcelas. Nos mostraron los tipos de patatas que crezcan (que sab칤a que hab칤a tantas variedades), las cobayas generan para la comida y las llamas se plantean a su lana. La madre mostr칩 c칩mo teje la lana para hacer bufandas, sombreros y dem치s piezas de ropa. Puedes comprar despu칠s y el precio es mucho mejor que encontrar치 en otro lugar. Si viajas a Puno - recomiendo encarecidamente esta actividad."
5,2 mayo 2014,Vale la pena,"Nuestro tour incluido Sillustani como viaje opcional por una ""tarde libre"".Nos alegramos de haber decidido ir, porque este sitio es impresionante. pero todav칤a no est치 completamente descubierto y s칩lo parcialmente conocido y estudiado, pero todav칤a tiene mucho que ofrecer.Este lugar vale la pena un desv칤o durante su estancia en Puno o cerca del lago Titicaca."
4,1 mayo 2014,Buen viaje,"Suri Tours muy bueno: Me gust칩 la parada en la granja local en camino a casa. Crumblies eran bastante interesante, aunque la vista desde la colina era mejor! Bastante duro trabajo levantarse en la delgada atm칩sfera."
4,30 abril 2014,Visit칠 aqu칤 en nuestro camino de Puno al aeropuerto de Juliaca,Lugar realmente incre칤ble en el medio de la nada con fant치sticas vistas del lago y de las islas cercano. C칩mo los Incas construyeron estas torres funerarias es impresionante! Si vas al aeropuerto tome tiempo para venir aqu칤.
4,26 abril 2014,Otro sitio arcological incre칤ble cerca Puno,"este es uno de los muchos sitios arqueol칩gico incre칤ble Per칰. Ten칤amos un magn칤fico gu칤a de tour y sin 칠l hubiera sido otro sitio. La historia detr치s de esta era muy, muy bueno. Incluso si es c치lido y no recuerda traer algunos jugadores, as칤 que no est칠 demasiado fr칤a. El relativamente corto paseo es f치cil comparado con muchos otros sitios que se elevan en Per칰. En vista del lago Titicaca fue maravilloso."
4,21 abril 2014,Disfrute de las incre칤bles vistas,Este complejo de torres salas funerarias es una pen칤nsula elevada cima detallados por igual en un pintoresco lago/Lake. Las torres son interesantes. ver치 ejemplos de torres de tres diferentes grupos ind칤genas. La vista de la laguna desde la parte superior de la colina merece la pena el viaje. El Plan para ir en su camino desde el aeropuerto o dos como esta pen칤nsula est치 situado a mitad de camino entre el aeropuerto de Juliaca y Puno.
4,21 abril 2014,"traiga ropa de abrigo, un corto viaje fascinante","Esta breve pero muy comprometedor viaje desde Puno es bien vale la pena. lo hicimos en finales de abril como la estaci칩n de lluvias, y disfrutamos mucho. Mientras que lo m치s probable es que se puede ir sin gu칤a, hay mucho por aprender de un gu칤a capacitado, vale la pena las 35 soles para invertir en que alguien proporcionar la informaci칩n y antecedentes para usted para que pueda comprender la gente, la cultura y donde los Incas llegan a estas extraordinarias estructuras. Es una inversi칩n tres horas. El sitio es muy ventoso, y por lo que yo entiendo las excursiones ir a las 2 de la tarde, as칤 que es m치s tarde en el d칤a y en el momento que estamos terminando la excursi칩n puede ser justo fr칤o. capa. Traiga una lluvia jacker y sombrero y pantalla solar sin duda, est치s muy alta. Las mejores gu칤as de viaje tomar lo m치s f치cil en el corto escaladas con pausas para darle historia en los templos, el uso de agua, historia de los pueblos, las excavaciones arqueol칩gicas y c칩mo la gente fueron enterrados en las torres. Una obra verdaderamente interesante y 칰nica de historia.Hay un sendero hasta y desde el sitio con el t칤pico turista ofrendas de mercanc칤as, ni침os con alpacas que quieran fotos y un lenguado para el bano, y tambi칠n tienes la posibilidad de visitar una de las casas locales. Esta ofrenda es bien vale la pena cuando est치s en un tour. Las familias locales viven en un peque침o complejo que est치 hecha de roca, a menudo con algunas de las piedras muy grandes tomada desde las torres de funereal desde muchos a침os antes. Los gu칤as conocen las familias, y que son capaces de visitar estos peque침os compuestos para ver c칩mo vive la gente, comer, trabajar y utilizar locales hierbas y alimentos para la medicina. Su contribuci칩n de unos 3-5 soles proporcionar ingresos para las familias y reconocer gracias a la intrusi칩n en sus vidas. Para la oportunidad de ver algo que de lo contrario nunca ver, hacer esto. no se puede visitar estas casas por si mismo y por eso merece la pena una visita."
5,20 abril 2014,Una visita obligada,impresionante!!! Recomiendo hacer una parada aqu칤. vistas maravillosas y una gran historia. Fue un paseo agradable y vistas del lago Titicaca eran incre칤bles.
5,11 abril 2014,El lugar m치s bonito alrededor de Puno,"Un lugar tranquilo en medio de la nada. llegar all칤 con la por cierto de autob칰s Puno y Juliaca y pide a parar en el ""desvio Sillustani"" entonces, hay muchos taxis y colectivos esperando. Se lo recomendar칤a a tomar un tour guiado a no perder ninguna de las construcciones fant치sticas ver치!"
5,7 abril 2014,Un lugar precioso con una historia interesante,"Sillustani es realmente precioso. Cuando llegas a la cima de la colina, las vistas del lago son incre칤bles. Las Chullpas asociada y su historia es muy interesante. Definitivamente vale la pena una visita."
4,4 abril 2014,sitio interesante en una hermosa ubicaci칩n,"monumentos funerario interesantes de fondo de vistas incre칤bles. Por desgracia, las tablas de informaci칩n no son muy informativos y nuestro gu칤a (con visitas a Edgar que era muy bueno para el viaje en barco a islas de los Uros) era basura! Intenta ir por la ma침ana si puedes (la mayor칤a de las excursiones parecen ir por la tarde pero en ese punto fr칤a requieren cierto tiempo y la luz es malo)."
5,24 marzo 2014,hermosas High Plains Andino,"Alquilamos un taxi a trav칠s de nuestro hotel para llevarnos a Sillustani en el camino hacia el aeropuerto de Juliaca (solo por ser construido as칤 que no esperes mucho o llegar demasiado temprano). Las ruinas son secundarias al hermoso paisaje con islas, lagos y nubes de era espacial. fijara 2 horas m칤nimo para disfrutar y relajarse en este lugar muy especial."
5,28 febrero 2014,sitio interesante para el entierro,"Este hotel se encuentra en un lugar remoto, pero merece la pena de hacer una parada en el camino hacia o desde el aeropuerto de Juliaca o Puno Lago Titicaca. Una oportunidad de ver pre-Inca ruinas."
4,17 febrero 2014,Muy buen sitio/ruinas,s칩lo necesitar치 aproximadamente una hora para visitar este sitio. Interesante con magn칤ficas vistas. tiene entrada moderna hasta las ruinas y luego hacer la caminata por sendero y escaleras.
5,3 febrero 2014,Lugar m치gico,"Este lugar es m치gica, es una hermosa combinaci칩n de cultura y naturaleza, coger el amanecer en este lugar es espectacular, la gente es muy amable y todos queremos ayudar"
5,1 febrero 2014,Fascinante,"Esta zona de pre-Inca tumbas est치 ubicado en una zona preciosa con una vista maravillosa de los lagos y las colinas circundantes. Las tumbas se encuentran ruinas pero muy interesante. Est치n en 14,000 pies."
4,31 enero 2014,Una visita obligada en Puno y comprensi칩n de las tradiciones de Inca,"Mis rodillas segu칤an sufriendo despu칠s de visitar Machu Pichu pero estoy encantado de haber hecho el esfuerzo.No s칩lo las ruinas y su historia en la civilizaci칩n muy interesante y ayuda a comprender mucho mejor la Inca, puedes ver lago Mayo desde el 칰ltimo que es muy hermoso. De camino all칤 la carretera le lleva por tierras de labranza y encontrar치 un mont칩n de llamas y Alpacas. Puedes tener suerte y visitar una granja t칤pica india. S칤, es una larga caminata, pero merece la pena"
5,31 enero 2014,Precioso y relajante e hist칩rico,Realmente disfrutamos de este sitio arqueol칩gico situado en lo alto del Lago Titicaca. subir la colina es lento y gradual. Y los lugares de inter칠s en esta elevaci칩n son impresionantes. La ciudad es adorable.
