rating,date,coment_title,coment_description
3,13 noviembre 2016,Vale la pena una breve parada,"Las tumbas de sillustani son Inca y pre-Inca y est치n situados en la cima de una colina. La altitud es de unos 12, 00 metros, as칤 que caminar hasta ellos era un poco dif칤cil. Como estaba lloviendo, no fue nuestra mejor actividad."
5,31 octubre 2016,Lugar de nacimiento de los Incas,"Las torres y las vistas son incre칤bles. Usted ser치 sobre 13, 000 pies en estas torres. Cuentan con la pre-inca de entierro jardines. Los esfuerzos agr칤colas son bastante interesantes. Quiz치s su tour parar치 en la casa de alguien para ver c칩mo viven y lo que hacen con su tiempo. Nuestro grupo pareci칩 real interesante."
4,27 octubre 2016,Grand View de la pre-historia colonial,"Sillustani fue la primera cosa que visitamos cuando nuestro grupo lleg칩 a Per칰, y me alegro. Machu Picchu sin duda compensan Sillustani en t칠rminos de complejidad y grandeza, pero hab칤amos alquilado un gu칤a que nos dio una visi칩n fascinante de lo que significa la zona. Las vistas desde la colina son bien vale la caminata moderada."
5,27 octubre 2016,Hermosos e interesantes,"Esta fue nuestra 칰ltima atracci칩n de nuestro tour de Per칰. Nuestro gu칤a nos llev칩 aqu칤 en nuestro camino al aeropuerto. Fue una bonita zona con maravillosas vistas de la zona. Tuvimos un gu칤a, de lo contrario no nos comprendan plenamente la importancia de la zona. Tuvimos un paseo suave pero largo alrededor del enterramiento. Fue muy impresionante y me alegro de que no estuvimos en el autob칰s."
4,26 octubre 2016,Interesante!,"Fue interesante observar en el sitio antiguo, y c칩mo el pre-Inca e Inca veces. Ser칤a bueno alquilar un gu칤a tur칤stico para que puedan explicarte el significado de lo que est치s mirando."
4,26 octubre 2016,Bonito viaje de medio d칤a y muy asequible.,"Viajes de medio d칤a (14. 00 a 18. 00) a Sillustani se pueden comprar todo Puno y el precio es pr치cticamente el mismo (35 Soles pr. Persona).Vale la pena tener un viaje guiado, ya que este le da un mejor entendimiento del lugar.Pero incluso sin un gu칤a es una zona preciosa con una bonita vista de las ruinas y el lago titikaka (no).Fuimos como una familia con un ni침o de 9 a침os con mucha energ칤a y fue genial. Hay espacio para correr y explorar las ruinas y puede ser tocado."
5,25 octubre 2016,Casi como un buen machu picchu,"Debes ver si ir al Lago Titicaca por un par de d칤as. Ubicado en la cima de una colina con vistas incre칤bles sobre los lagos y llanuras se encuentra el magn칤fico las ruinas de Sillustani colombiano. Estas espectaculares ruinas pertenecen a las personas que hab칤an sido ayamara conquistado por el Inca en C 15. Enorme torre como tumbas funeral llamadas Chullpas siembran el paisaje, muchas de las cuales hab칤an sido soplado por raiders tumba. Por encima de estas c치maras funerarias baja fueron construidos para albergar toda la familias ampliadas de la nobleza y los cuerpos fueron enterrados en el feto postion. La arquitectura del complejo y las vistas incre칤bles para una excursi칩n de cerca de Puno."
4,27 septiembre 2016,De Sillustani tumbas son un magn칤fico sitio Inca,"No es realmente conocido para el p칰blico en general este magn칤fico sitio tiene un nombre inca sellada alrededor!Su ubicaci칩n geogr치fica es simplemente perfecta, sientes que est치s casi tocando el cielo.Rodeado por lagos y estanques por debajo!Una vista m치gica.Una perfecta ubicaci칩n estrat칠gica/muy cerca y casi ocultas.Es realmente una joya!Se puede hacer solo o mejor con un gu칤a local.Tallas en las rocas.Restos de el templo del sol y el templo de la luna y m치s.Absolutamente magn칤fico!S칩lo quer칤a mencionar que la elevaci칩n es alta:13.000 pies sobre el nivel del mar.Un mont칩n de escaladamuy ventoso - no se olvide de llevar sombrero, guantes, bufanda, protector solar!"
5,26 septiembre 2016,P치ginas Regionales,"Gran zona para aprender sobre la historia inca y otras culturas regionales del pasado y del presente. Disfrute de todos ellos, pero especialmente la gente y sus islas flotantes de Uros y la Isla Taquile,"
5,25 septiembre 2016,De Machu Picchu,"Disfrutamos de este sitio tanto como Machu Picchu. Menos tur칤stico, m치s aut칠ntico y la pena la parada. Paisaje impresionante y mucha historia."
4,23 septiembre 2016,"Dif칤cil respirar, pero vale la pena.","Este es comprobar incan y incan tumbas. Un gu칤a es 칰til aqu칤. Esto est치 fuera de Puno, pero vale la pena una visita. Lago Umayo es preciosa y la ciudad es muy 칰nica. Per칰. Las familias viven en compuestos poco y mantienen todo muy ordenado y limpio. Era mi ciudad favorita en Per칰. Las tumbas estaban en la cima de la colina y sus pulmones odian, pero las vistas valen la pena. Tome su tiempo subiendo, ya que hay cosas que ver como un coche de la serpiente en un rock m치s Ed los templos del sol y la luna. Permite ajustar."
4,23 septiembre 2016,Lugar interesante!,"Tuve un momento dif칤cil decidir qu칠 hacer con mi 1 d칤a en Puno, as칤 que optamos por un tour de medio d칤a por las cadenas monta침osas. Era barato, a s칩lo 40 soles. Es una manera fuera de la ciudad, pero a menos de una hora. En una pen칤nsula, y tienes que subir una colina de tama침o decente, as칤 puedes ver la chulpas. Cuanto m치s se aproxime a la cima, el enfriador est치. Un mont칩n de foto gran ops y escuchar las historias de los milleniums de personas (bien antes de los incas) que utilizaron estos, es bastante interesante"
5,22 septiembre 2016,Lugar muy interesante,"Paramos aqu칤 en nuestro camino al Aeropuerto de Juliaca. Nuestro gu칤a podr칤a explicar el prop칩sito del sitio, su historia y de las estructuras. Realmente fascinante. La vista desde la meseta es muy agradable. Vale la pena una visita."
5,16 septiembre 2016,Fabuloso lugar para salida,"Fuimos a visitar ese lugar justo al llegar a Puno. No es en s칤, pero en Puno 45 minutos o as칤, en el campo. Tendr치 que conducir a trav칠s de un paisaje agradable, hermoso, ver치 las granjas, alpacas, llamas y flamencos! El sitio es impresionante y yo le recomiendo conseguir una gu칤a para obtener un mejor sentido de lo que se ve (a menudo en Per칰, no hay mucho sitio en la explicaci칩n). Los alrededores son espectaculares y lo pondr치 en la atm칩sfera para su viaje en el Lago Titicaca. Lo recomiendo encarecidamente!"
5,8 septiembre 2016,Conseguir una gu칤a,"Lugar necesita una gu칤a as칤 que puedes entender qu칠 est치 pasando y qu칠 se est치 haciendo.
Sin un gu칤a le pondr칤a un 3"
4,8 septiembre 2016,Vale la pena una visita,"Sillustani es un cementerio pre-Inca a orillas del lago Umayo, cerca de Puno en Per칰. Este es un 칰nico, fascinante, un sitio hist칩rico y muy pintoresco. Era parte de un tour por tierra envasados. Hab칤a una tarifa para entrar, sin embargo, no estoy seguro de c칩mo fue. Est치s m치s de 12.000 pies sobre el nivel del mar y hay una bastante ""f치cil"" sinuoso camino hasta la cima. Tambi칠n hay pasos bajando. Como un mont칩n de lugares hist칩ricos, podr치 obtener m치s fuera de lugar con un gu칤a, etc. Hay un sendero con algunos recuerdos tur칤sticos destaca entre el aparcamiento y el comienzo de la subida a la cima. Adem치s, todos los ba침os hay ba침os en ""pagar""."
4,2 septiembre 2016,Inca sitio de entierro,"A 45 minutos de viaje en coche le llevar치 a la tumba inca en Sillustani. El viaje le lleva a trav칠s de la tierra eran la agricultura puede parar y averiguar m치s sobre la vida en un ladrillo de barro (Adobe). El sitio inca consta de una serie de pre Inca y tumbas incas. Muchas de las tumbas han sido restaurados, pero algunas son originales. Una visita obligada para cualquiera que quiera saber m치s acerca de la cultura inca."
5,2 septiembre 2016,Lugar tranquilo y pac칤fico,30 minutos a pie hasta la cima para ver los monumentos y las fant치sticas vistas del lago. No es dif칤cil y nunca tuvimos quejas para hacerlo. No te olvides de construir su propio monumento con dos hojas de coca en el interior.
5,1 septiembre 2016,Antes de la cena,"Esta excursi칩n me pareci칩 bueno para un evento por la tarde, antes de la cena. Es aproximadamente 3-4 horas que ofrece un gran lugar para disparar im치genes foto. Recomiendo la direcci칩n lejos de la gu칤a para tomar las fotos antes de la visita (20-30) consiguen de la manera. Las vistas desde las tumbas y en el lago har치 algunos recuerdos inolvidables, que le dejar치 en total satisfacci칩n por pagar los 40 soles."
5,30 agosto 2016,Gran vista del lago,"Disfrut칠 de la visita guiada y Aprendimos mucho sobre el Inca"" cemetaries'. Me encant칩 el panorama en ese lugar. Incre칤ble."
4,30 agosto 2016,Bonito pueblo con historia antigua,"Est치 a unos 30 minutos andando hasta las tumbas, as칤 que lleve zapatos c칩modos. Adem치s, el camino est치 lleno de polvo, as칤 que lleve zapatos c칩modos que no te importa. Ahora una vez en la cima, la vista es maravillosa, la historia es interesante, y a aquellos que las tumbas son una visita obligada! Hace un poco de viento all칤 arriba durante el invierno, pero nada intolerable. Yo recomendar칤a este viaje de medio d칤a si est치s en Pumo."
5,30 agosto 2016,Las tumbas de diferentes culturas a lo largo de varios siglos,"Es incre칤ble ver c칩mo los nobles dieron sus Chullpas (torres cil칤ndricas tipo de tumba) en diferentes culturas. Hay una amplia gama de la r칰stica muy antiguas a las sofisticadas, bien rock pulido en los tiempos inkan. Todo esto en 13,120.fasl (4.000 MAMSL)."
3,29 agosto 2016,Viaje promedio y demasiado caro,"No es un gran lugar para visitar. Aceptamos este como una invitaci칩n, as칤 que estaba bien. Me gu칤a no hablan muy poco ingl칠s, por lo que incluso la informaci칩n que nos dieron era pobre y limitado."
5,28 agosto 2016,"Fascinante viaje, vaya con todas las formas y montar en un pat칤n","Fuimos en agosto, 2016, con todas las formas de viaje. Su visita se llama la Excursi칩n Sillustani y Cultural incluye aproximadamente una hora en un rinc칩n remoto del Lago Titicaca, y un paseo en barca de un pescador local. Est치 vac칤o, y el lago es precioso. Hay p치jaros y vicunas y otros animales. Vimos otro inserto de pescadores en sus redes. La mejor parte? Los turistas! Mi marido y yo. Y, entonces, desde el barco, que sube a Sillustani y disfrutar de las impresionantes ruinas y da. Uno de los puntos destacados de nuestro viaje de 11 d칤as peruano."
4,22 agosto 2016,Manera de enterrar sus muertos.,Hicimos una excursi칩n a este sitio arqueol칩gico localmente en Punto con edgar. Tuvimos un gu칤a excelente. La gu칤a explic칩 las diversas personas formas fueron enterrados. Se distinguen cuatro periodos. Los monumentos de la 칠poca del inca alrededor de 1500 a m칤 personalmente me pareci칩 de lo m치s impresionante.
5,19 agosto 2016,"Tranquilo, aislado, una tenue",Lugar de descanso de la familia real inca en piedra conocidas como Chullpas. En elevaci칩n muy alto y de repente sentir menos ox칤geno. Impresionante vista del lago desde la parte superior hace una visita obligada cuando de sillustani en Puno.Ahorre dinero reservando un taxi durante medio d칤a en 180 soles mientras que pagar 170 por persona a una agencia de viajes.Hacer una parada en el camino y las aldeas locales pedir permiso para fotografiar los alpacas y llamas de sus propietarios.Puede que piden pagar ellos soles as칤 que prep치rate para pagar o no tomar la foto o en absoluto.P칩ngase varias capas como el clima cambia r치pidamente y llevar cambio para usar los servicios aqu칤.
5,17 agosto 2016,Muy interesante con vistas incre칤bles,Despu칠s de una decepcionante visita de Uros islas realmente disfrutamos de nuestra visita a Sillustani. La web es muy interesante y las vistas son absolutamente impresionantes. Sin duda vale la pena el desv칤o.
4,11 agosto 2016,Muy interesante,"Viajar al otro lado del lago con la gente local en sus barcos fue muy divertido. (para nosotros) el sitio hist칩rico es muy interesante. T칩mese su tiempo, ya que la subida a la chopas recarga si no est치 acostumbrado a la altitud pero"
3,9 agosto 2016,Interesante lugar para los amantes arqueol칩gicos,"Lugar dif칤cil llegar a menos que tengas un coche. Muy ventosa, remotas y aisladas. Interesante si te gusta ruinas y la historia antigua. No estoy seguro de que est치 desarrollado para ser vale la pena el esfuerzo. Algunas de la se침alizaci칩n es tiempo - gastados y dif칤cil de leer. Un mont칩n de puestos de artesan칤a local en la entrada y una peque침a cafeter칤a."
5,8 agosto 2016,Naturalmente espiritual,"Los curiosos torres funerarias son interesantes, pero para m칤 lo mejor fue llegar a la cima (4.300 m) o por ah칤, que estaba a unos 150 metros y ver el ascenso isla volc치nica y su extinto cr치ter lleno de agua. Sentados en una roca colgante y recorriendo el paisaje era lo suficientemente tranquilo."
5,3 agosto 2016,"Graves, Monumentos, lugares de entierro, lo que sea!","Este lugar es llamado por muchos nombres. Sea lo que sea, Sillustani es un pre-entierro en el lago Umayo justo fuera de Puno. Desde la 칰ltima vez que estuve aqu칤, han completado la construcci칩n de bancos de bonito en las calles con tonos en la ciudad en el camino a la hora de sitios.Mientras las chullpas reliquias son la torre como estructuras construidas sobre tierra que alberg칩 los restos de las elites de las torres de piedra son ""uta Amaya"". Hay otras chullpas en toda la regi칩n, incluyendo algunos que vimos en Tiwanaku. La metodolog칤a antigua de preservar los cad치veres inclu칤a algunos rituales y ciertas formalidades para honrar a los muertos, es decir, las aberturas de los edificios est치n orientadas al este, as칤 que la energ칤a del sol en la tierra madre revitalizado sostendr치 su conservaci칩n. Ah, este es uno de los pocos.Es un territorio sagrado. Mientras est치bamos all칤, el gu칤a nos hizo formar un c칤rculo, cerrado los ojos para sentir la energ칤a que nos rodea. Algunas personas relacionadas con este proceso mucho m치s familiar que otros. Yo lo hice.Una agradable experiencia."
5,27 julio 2016,Vale la pena el desv칤o. Realmente incre칤ble!,"Estoy tan contento que decidi칩 incluir la sepultura sillustani terrenos de camino al Aeropuerto de Juliaca. Fotos realmente no hacen justicia - es simplemente incre칤ble y 칰nica - a diferencia de cualquier cosa que he visto en Per칰! Fuimos tarde que presum칤a de las chullpas en la luz perfecta. B치sicamente ten칤amos el lugar para nosotros como los autobuses de excursi칩n estaban ocupadas y el 칰ltimo grupo de personas estaba a punto de salir.Fuimos con un gu칤a y lo recomiendo de verdad que hacer eso. Fue muy interesante y no nos hemos conocido mucho acerca de que si nosotros lo hicimos nuestra propia lectura antes de nuestra visita.Hay aseos en la zona de aparcamiento, pero ninguno en el actual sitio web. Bastante bien y hasta ten칤a papel higi칠nico. Hay un poco de una caminata entre la zona de aparcamiento y el enterramiento.Tome agua! No necesitamos sombreros o protector solar, ya que era tarde en el d칤a, si lo recomiendo si est치s de visita durante el d칤a. Aunque era bastante fr칤o en Puno, el sol era bastante potente sobre la piel. Lleve zapatos c칩modos que implica unas cuantas escaleras bajando (el camino es una constante). incline f치cilUno de los puntos destacados de este desv칤o estaba de visita en casa de un agricultor en el camino de vuelta desde el enterramiento- mencion칠 a la gu칤a c칩mo me pareci칩 interesante su forma de vida y 칠l pedimos inmediatamente el conductor se ubicaba en uno, fuimos de las casas y salieron a dar la noticia, el agricultor es darnos la bienvenida a su casa! Lo mejor de mi d칤a!"
3,24 julio 2016,Una buena manera de pasar una arvo,Una buena manera de pasar la tarde. Yo era el 칰nico en mi grupo que no estaba desde alg칰n lugar de Am칠rica del Sur y por lo tanto el 칰nico orador ingl칠s as칤 que camin칠 fuera y no mi propio tour. Que yo prefiero de todas formas. Las ruinas son frescos y vale la pena visitar.
5,20 julio 2016,M칤stico,Este es un sitio de entierro antiguo (tiempos pre-inca) es una excursi칩n de medio d칤a desde Puno. Utilizamos el excelente servicio de Mas칤as Huam치n Lutgardes PeruVivo/para organizar este viaje.Las Chullpas de sillustani (torres de entierro) son unos 30 km fuera de Puno. Despu칠s de llegar a la zona de aparcamiento de sillustani sitio explora el restos de este cementerio para reyes y nobles en pie (de ida y vuelta no 1 hora).
3,14 julio 2016,M치s rocas!,"Visitamos al final de nuestro viaje, despu칠s de ver muchos, muchos sitios y pre-Inca inca. Mientras estaba muy bien y tranquilo, me hubiera estado bien evitando esta parada de nuestro viaje."
5,12 julio 2016,La historia cobra vida,Impresionantes ruinas de torres funerarias construidas por los incas. Las vistas de los alrededores y al lago desde la cima del parque es la pena el paseo. Toda una perspectiva diferente en la zona del Lago Titikaka Puno/y vale la pena el corto viaje.
4,11 julio 2016,Vale la pena una visita corta!,"Paramos aqu칤 a la vuelta al aeropuerto. Hay una cantidad limitada de ver, pero a칰n as칤 vale la pena el tiempo"
5,5 julio 2016,Debe ver,"Esta fue la 칰ltima visita al museo arqueol칩gico encontrar en nuestro viaje. La zona era preciosa. Las ruinas de sitios funerarios son incre칤bles. Los lagos y vida salvaje, la gente debe ver. Fue una estupenda manera de terminar nuestro viaje y el ambiente m치s calmado necesitado. Pasar varios d칤as en altitud era sin duda un reto, pero sin duda vale la pena."
5,30 junio 2016,"Chulpas, Chulpas, vistas al lago impresionante!",Me sorprendi칩 lo bien que el gobierno local ha gastado dinero en una magn칤fica entrada bien dise침ado a Sullustani. **** (4 estrellas). Las ruinas y la gu칤a era fenomenal. Se lo recomendar칤a a todo el mundo para visitar.
4,28 junio 2016,Torres inusual cil칤ndrico,"Me dijeron que las torres funerarias de sillustani, construido mucho antes de los Incas, son quiz치s los mejores y las construcciones cil칤ndricas m치s perfecto de Antiguo Per칰. Este es un poco lejos, pero me pareci칩 muy interesante y claramente, hist칩ricamente importantes. Hay un poco de un paseo desde el aparcamiento a las torres. Hay una hermosa laguna a los pies de la plataforma natural de sillustani."
5,19 junio 2016,Excelente,"Muy bonito y m치gico de visitar el enorme tumbas funerarias, cerca de una laguna preciosa y tranquila, muy bien organizado por la agencia de informaci칩n muy precisa y muy f치cil de pagar."
4,15 junio 2016,Torres funerarias y precioso lago!,Reservamos esta excursi칩n fuera de Puno para ver la torres funerarias y qued칠 bastante impresionado. El senderismo fue muy corto y la historia de las excursiones es muy interesante. Un mont칩n de buenas vistas al lago detr치s de las torres y los alrededores de tierras onduladas.
5,6 junio 2016,Incre칤ble,"Gran lugar con fant치sticas vistas de todo
es diferente de cualquier sitios Incas nos han
obligado a los visitantes de la zona de Puno"
5,6 junio 2016,Excursi칩n de un d칤a ideal para primera,"Sillustani est치 no lejos de la ciudad de Puno. Por lo tanto, la mayor칤a de excursi칩n le llevar치 hasta un m치ximo de 4 horas. Es ideal para aclimate altitud. M치s que eso, el paisaje es hermoso."
5,5 junio 2016,Gran tour - mucho m치s de lo que esperaba!,No tienen mucho que hacer en nuestro 칰ltimo d칤a en Puno y decidimos tomar un tour a Sillustani y era mucho m치s de lo que esper치bamos! Las vistas eran magn칤ficas y la historia era muy interesante. Gran lugar para comprar - probablemente el m치s barato de los precios que vimos en Per칰 y hay un mont칩n de casas de parada en el camino para tomar fotos/lama de alpaca.
4,4 junio 2016,Disfrutamos de este,"Fuimos en un d칤a nublado fr칤o que agrega en realidad al ambiente del lugar. Era interesante, (aseg칰rese de tener un gu칤a muy bien informado) de ver y escuchar. Las vistas son magn칤ficas y el viaje all칤 pasa por peque침as villas. Fue un buen viaje de medio d칤a de Puno."
4,3 junio 2016,Las ruinas de la tumba/enterramiento,"Nos sorprendi칩 la tumba; nos alegramos de estructuras visit칩, la carretera muy accidentado al sitio. As칤 que, si tienes problemas de espalda, no podr칤a ser la mejor opci칩n. Al retorno de sitio, no pare en casa de familias de trabajo y estilo de vida."
3,2 junio 2016,"Interesante para visitar, pero podr칤a haber pasado.","La visita fue con nuestro grupo de viaje y en el momento en nuestro camino a Sillustani, fue hasta el final de nuestro recorrido de Per칰. En ese punto hemos visto tantas ruinas, que podr칤a haber elegido en esta visita. Si hubiera sabido lo que nos esperaba, me hubiera elegido para alojarse en Puno por la tarde para explorar la ciudad. La historia es interesante y el paisaje era precioso. Las tumbas se reparten por todo lo alto de la colina y se puede caminar libremente por la zona. Sin embargo, fue una visita corta, en general, m치s tiempo pasamos en el autob칰s para llegar all칤 y volver al hotel. El paseo hasta las ruinas est치 lleno de gente que venden el mismo regalo que puedes ver en cualquier otro sitio."
4,1 junio 2016,Visitar Niza,"Valen la pena, especialmente en el camino hacia o desde el Aeropuerto de Juliaca. Las ruinas est치n bien, y el entorno es bastante bonito."
5,31 mayo 2016,Impresionante,"Simplemente hermoso! Nuestro hotel nos reserv칩 una excursi칩n por la tarde. Es hermoso para tomar fotograf칤as mientras se pone el sol. Eres libre para pasear, pero vale la pena una visita a la reserva m치s informaci칩n posible. Muy interesante la historia."
4,24 mayo 2016,Interesante Inca y Colla de enterramiento,"A una hora de Puno tom칩 este opcional para ver los edificios de su entierro de personas tanto colla e inca.
Es una subida gradual de la meseta donde toombs ubicado. Muy interesante ver las estructuras y el paisaje de meseta impresionante."
4,19 mayo 2016,Vale la pena ir de forma independiente,"Reservamos un taxi para que nos llevara (110 soles - que podr칤a haber sido m치s barato si no lo hab칤a hecho a trav칠s del hotel). Fuimos en la ma침ana y aunque hab칤a algunos autobuses de excursi칩n all칤, probablemente m치s concurrido en la tarde.Me pareci칩 muy bonito, y me encant칩 poder caminar libremente admirando las torres funerarias. El fondo del lago es sencillamente impresionante! Mi 칰nica decepci칩n fue no que no ver ning칰n guinea cerdos salvajes, que hubiera sido lo m치s destacado para m칤."
5,18 mayo 2016,Un lugar incre칤ble,"El lago es una maravilla, tienes que visitar este lugar! Puede tomar un mont칩n de buenas fotos, la vista mientras el tambi칠n es incre칤ble."
4,18 mayo 2016,Remoto y algo m칤stico,"Este sitio es un poco lejos de Puno y/o Juliaca. Situado en terreno alto con vistas a un lago pr칤stino, es comprensible que las antiguas construcciones eligieron esta zona por los ritos de entierro. Hay una tranquilidad una vez que llegue a la meseta, especialmente cuando el viento silba un poco ya que dan al lago."
5,17 mayo 2016,"Pre-Inca y interesante torres funerarias inca, en el encantador y tranquilo lago Umayo.","Nuestra 칰ltima parada tur칤stica en Per칰, en nuestro camino desde Puno hasta el aeropuerto m치s cercano, Juliaca. Tuvimos un gu칤a excelente que dio mucha informaci칩n sobre el sitio as칤 como la gente de la regi칩n."
4,15 mayo 2016,Ir antes de que se convierta en un turista - fest,"Este era un sitio muy interesante: el 치rea inmediatamente alrededor de las torres en s칤 es en gran medida intacta, pero hay un aparcamiento construido recientemente, centro de visitantes (?) y una amplia avenida flanqueada por puestos de mercado que conduce al sitio. Comprensible, pero una pena de muchas maneras. Y cuidado con las ara침as: el lugar ten칤a mucho de lo que creemos fueron las tar치ntulas!"
3,7 mayo 2016,Torres funerarias con vistas!,"La Torre era b치sicamente el entierro sillustani un mont칩n de torres. La mayor칤a de las torres fueron renovadas, tom칩 al menos una hora en autob칰s para llegar al lugar y fue un paseo para el sitio. Puno estar en una posici칩n m치s elevada, el paseo era una buena caminata porque era cuesta arriba. Realmente tenemos que tomar su tiempo, parada para recuperar la respiraci칩n y contin칰e en. En la parte superior de la vista era incre칤ble. Llegamos cuando el sol estaba alto y caliente, pero el viento era fr칤o en la cima. Poner un mont칩n de protector solar y estar un poco de agua.Hay 치reas que me explic칩 lo que encontraron en el sitio. El sitio era b치sicamente una torre de sepultura para la 칠lite de la sociedad en ese momento. Tambi칠n mostr칩 c칩mo momificaban los muertos en ese momento."
4,3 mayo 2016,Torres funerarias muy interesante desde m치s de una civilaization,"Este lugar est치 aproximadamente a una hora en coche de Puno, parte de ella, a lo largo de caminos bastante malos. Pero vale la pena al llegar all칤. Hay restos de torres funerarias de la 칠poca inca y de nuestros civilizaciones tambi칠n. La mayor칤a arruinadas, pero se puede ver c칩mo deben de tener. El lugar tiene un tipo de belleza salvaje vac칤a. No hay muchos turistas, cuando nos fuimos, lo que hizo que el drama."
4,27 abril 2016,Importante sitio de entierro Pre-Inka,"Este sitio antiguo a 14 kms de la salida de la autopista es bastante interesante parada para aprender m치s sobre las culturas que precedieron a los Incas. La arquitectura y la ciencia detr치s de estas estructuras es muy intrigante. La se침alizaci칩n en espa침ol e ingl칠s no es extenso. Tuvimos un gu칤a tur칤stico, pero no estoy seguro de si se puede alquilar uno en el lugar.Como de costumbre alrededor de Per칰 la carretera est치 bordeada por un solo proveedor tras otro los vendedores de sus productos peruanos."
