rating,date,coment_title,coment_description
4,9 abril 2018,Buena experiencia,"Muy bien cuidado, las chulpas son mas grandes de lo que parece. La pista para llegar tiene muchos huecos y hay que tener cuidado con eso."
4,28 marzo 2018,Gran sitio para aprender sobre la cultura Aimara,Me gusto bastante ya que fuimos con un gu칤a privado que nos explico muchas curiosidades de la cultura Aimara como viv칤an y el por que de las construcciones. Me pareci칩 muy interesante la forma en la que constru칤an las tumbas y el porque.
5,13 marzo 2018,Hermoso lugar para relajarse,"Es un estupendo lugar donde se aprecia un atardecer espectacular un hermoso lugar para visitar.
La laguna umayo es como un espejo y cuenta con una reserva donde se puede ver vicu침as. Se los recomiendo dar un salto en sillustani"
5,11 marzo 2018,Realmente hermoso,"El lugar tiene una energ칤a increible, sientes la maravilla del lugar y la vista que tienes desde la cima es maravillosa. La peque침a caminata que tienes que hacer realmente vale la pena."
4,4 marzo 2018,Subida de dificultad media y buena vista en la cima,"En la entrada hay muchos puestos en donde venden artesan칤a y tambi칠n bebidas. Si bien la subida es corta, el hecho de estar en la altura hace que sea un poco m치s complicado. Una vez arriba se llega a las chulpas, si se sigue avanzando se tendr치 una espectacular vista a un lago que llega a conectarse con el lago titicaca.Se puede hacer todo en mediod칤a."
5,12 febrero 2018,Magestuoso,Es un pueblito peque침o..lindo..tranquilo..magestuosa sus ruinas. Nos dicen q se puede hacer turismo vivencial. Hay muchas artesanias para comprar. Hay un pago de ingreso de S/. 15 soles x adulto turista peruano. Desconozco si la tarifa es igual para turistas extranjeros.
5,6 febrero 2018,EXCELENTE,"Como lo he dicho en mis otras opiniones, la altura de 3800 msnm hace un poco pesado el paseo pero este lugar de todas formas hay que conocerlo, las chulpas de sillustani nos ense침a como las antiguas civilizaciones hac칤an culto a los muertos y como los enterraban muy muy muy interesante."
5,5 febrero 2018,Foto de Portada !!! ,"La mejor foto de portada la conseguir치s llegando a las chulpas, vale la pena llegar a la cima. Llevar mate de coca para el camino!!!"
4,5 febrero 2018,El esfuerzo vale la pena,"Puno est치 por encima de los 3800 msnm, para quienes vivimos a nivel del mar o a alturas menores a los 1000 msnm, visitar una ciudad como 칠sta puede traer algunas dificultades, el mal de altura se caracteriza por un malestar general con dolores de cabeza y agitaci칩n al menor esfuerzo f칤sico. Hay felizmente pastillas que ayudan, tome sus precauciones. Pero llegar a la cima y disfrutar de la experiencia de conocer el sitio arqueol칩gico y del paisaje circundante es m치gico, la reflexi칩n inmediata es ""vali칩 la pena"". Muy recomendable. La 칰nica observaci칩n es la falta de servicios adecuados, faltan ba침os de calidad y bien cuidados y el estacionamiento de carros est치 lejos de donde se inicia el ascenso innecesariamente."
4,23 enero 2018,Etructura Inca de nivel,"Seg칰n nuetro gu칤a es una tumba Inca donde descansaban los restos de la lata sociedad inca, por su construcci칩n son circulares de fina arquitectura Inca , vale la pena conocerla"
5,22 enero 2018,Sillustani tumbas pre incas,El lugar es hermoso nada comparado von otro sitio unico en tener una meseta hermosa y muchos hermosos paisasjes yo y mi familia contratamos un tour privado con pacha expedition y nos fue super bien salir en la.ma침ana donde habia poca gente realmente el servicio muy bueno gracias por todos los que hicieron de nuestro viaje inolvidable 
4,16 enero 2018,Atracci칩n arqueol칩gica,Impresionante atracci칩n arqueol칩gica de torres de piedra que fueran tumbas de importantes jefes incas.
5,11 enero 2018,Sillustani parada obligatoria,"Apreciar estas ruinas de Sillustani es como estar en el pasado y sentir que uno vive junto con los incas, el lugar de por s칤 es parada obligatoria para el turismo, la laguna de Umayo ofrece una vista muy relajante y tranquila, ideal para hacer meditaci칩n y conectarse con el universo, se recomienda ir sin tours para que tengan m치s tiempo de estad칤a."
4,10 enero 2018,Parada obligatoria,Lugar obligado que debes visitar si vas a Puno. Alrededor puedes encontrar las chullpas y restos arqueol칩gicos.
5,4 enero 2018,sillustani imperdible,"es un lugar donde encuentras mucha historia, el complejo es realmente hermoso, recomiendo que lo puedan hacer en familia, una experiencia inolvidable, de preferencia tomar el toiurs por la ma침ana, ya que corre bastante viento por las tardes, llevar bloqueador y agua"
5,28 diciembre 2017,TANTA HISTORIA EN UN SOLO LUGAR,"Hice un tour de aproximadamente 3 hras , antes de ir al aeropuerto para regresar a Lima , y definitivamente valio la pena. En la parte cumbre de se ecnuentran las Chullpas y una vista a una meseta que realmente vale la pena visitar"
5,17 diciembre 2017,Bello lugar!,"Este lugar es m치gico, caminata moderada cuesta arriba para ver de cerca las culpas y un lago impresionante"
5,10 diciembre 2017,M칤stico!,Ver fardos funerarios y tener una vista espectacular frente tuyo es la combinaci칩n perfecta. Lugar con mucha energ칤a y misticismo.
5,10 diciembre 2017,Un lugar que vale la pena conocer,No ten칤a planeado ir a este lugar pero como tuve tiempo libre contratamos un excursi칩n. Es un lugar donde hay tumbas pero el lugar tiene algo m치gico que se siente por la gran amplitud
5,30 noviembre 2017,Sillustani con pacha expedition la mejor opcion,Lleve los servicios de pacha expedition en el centro de la ciudad buenos precios buena calidad sobre todo buenos guias que te hacen una introspeccion social economica de las tumbas de lanciudad de puno y de los uros definitivamente si van puno y sillustani les recomiendo la agencia pacha expedition
5,28 noviembre 2017,SILLUSTANI - RECOMENDABLE !!!,"Dentro del recorrido por la zona de la ciudad de PUNO, llegamos a Sillustani y sus chullpas (tumbas sagradas). El lugar es muy bonito y es interesante conocer la historia del mismo, recorrerlo y conocer las construcciones que a칯n se mantienen en buen estado, las famosas chullpas. Recomendado !!!"
5,17 noviembre 2017,excelente,"tantas maravillas ofrecidas por la naturaleza no dejan de maravillarme, excelente paseo y excelente sitio turistico"
5,8 noviembre 2017,Excelente vista desde las chullpas,"Fuimos por la tarde, aunque se sentia un poco de frio, la vista de las chullpas y la laguna que se encuentra cercana fue genial."
5,8 noviembre 2017,De lo mejor de la zona de Puno,Esta s칤 es la visita imperdible de la zona. Entre Puno y Juliaca hay desvi칩 que lleva a este lugar que fue cementerio de antiguas civilizaciones que vieron ah칤. Sus construcciones valen la pena ir hasta ah칤 y recorrerlas en medio d칤a.
4,6 noviembre 2017,Gran experiencia,"La visita no demanda ser un full day, nosotros partimos a las dos de la tarde y estuvimos de regreso poco antes de la cinco. Tambi칠n desde subir hasta el tope de la monta침a pero la vista remunera todo esfuerzo. Puedes deleitarte con las construcciones f칰nebres de piedra y sacar muy buenas fotos. "
5,24 octubre 2017,Impresionante,"Visitar las Chulpas, conocer su historia apreciar la belleza de la Laguna de Umayo es una experiencia indescriptible. Es un punto de visita obligatoria si viaja a Puno."
5,15 octubre 2017,Magia y tranquilidad,"Incre칤ble lugar, con mucha historia, tranquilidad e incluso a trav칠s del pasado puedes inspirarte para hacer m치s cosas"
5,5 octubre 2017,Se respira paz y tranquilidad ,Es un cementerio Inca que si vas por la ma침ana hay poca gente (los tour los hacen por la tarde por lo general) podr치s visitarla muy c칩moda y disfrutar de una tranquilidad y unas vistas preciosasEl sitio arqueologico est치 rodeado de un lago que hace del lugar un conjunto m치s bonito
5,1 octubre 2017,Lugar de reflexion,"Impactante lugar poco conocido en nuestro entorno, pero espectacular, tanto por su significado, como por el entorno que lo rodeo. Te invita a sentarte y reflexionar sobre las preguntas que dan sentido a la vida."
5,25 septiembre 2017,M칤stico ,"M칤stica pura! Un lugar lleno de magia , y la vista a los lagos son espectaculares , venden artesan칤as ba침os etc etc lo recomiendo"
5,21 septiembre 2017,Increible,Lugar que combina naturaleza e historia. Las tumbas son geniales. Muy diferentes a lo que vemos en otro lugar del Per칰. La naturaleza alrededor es impresionante.
5,13 septiembre 2017,Gran vista!,Lugar perfecto para conocer un poco de la cultura y aprovechar la altura para apreciar el Lago Titicaca sin tener que navegar.
3,31 agosto 2017,Tour ,Un lugar muy fr칤o el m치s alto de Puno !!!! Existe una laguna inmensa y hermosa la cual permite las siguientes tomas un lugar con mucha historia y subiendo te cansas mucho pero espectacular ! 游뗿游낕
4,26 agosto 2017,Paseo arqueol칩gico y cultural,"Es un viaje corto desde Puno y de pasada se visita una de las peque침as aldeas de lugare침os. Si bien est치 preparado para el turismo no deja de ser interesante conocer algo de sus costumbres. Luego el plato fuerte, la tumbas de pueblos precolombinos e incas sobre una colina que permite una excepcional vista de un lago. Las ruinas no dejan de ser impactantes y el marco de la vista las potencian. No olviden llevar abrigo porque se finaliza la visita al final del atardecer y refresca mucho."
5,25 agosto 2017,Visita a un m치gico lugar,"Hermoso lugar, ubicado a 3897msnm y al subir se llega a 4012 msnm, ofrece una excelente vista de la Pen칤nsula y el Lago Umayo. Adem치s las edificaciones dan un ambiente m치gico. Hay que complementarlo con el Museo Carlos Dreyer para poder ver la t칠cnica y las momias."
4,15 agosto 2017,Bonito paseo cerca de Puno,"No es taaaan wow, pero es un paseo relajado cerca de Puno (entre Puno y Juliaca).
Hay que hacer una peque침a caminata para poder llegar hasta el otro lado y ver la laguna."
5,14 agosto 2017,Maravilloso,"Fue una visita preciosa, recomiendo ir con un guia ya que la explicacion de la historia del lugar vale muchisimo la pena."
4,8 agosto 2017,Icono de la regi칩n.,"Hermosas construcciones funerarias, rodeadas de un lago y vistas para recordar, ir con un gu칤a de ser posible as칤 les puede explicar la historia, y el contexto de los tiempos en que fueron construidas, y si no, igual vayan, no se lo pierdan. tomaran muchas fotos ya que las vistas son excelentes, un lugar obligado a visitar si estas en la regi칩n Puno."
5,6 agosto 2017,"Hermoso lugar, lleno de historia del Per칰.","En el camino uno puede ver divertidas vacas nadando en la laguna que est치 en la parte inferior del centro arqueol칩gico ah칤 en uno encuentra chullpas de las culturas Colla, Tiahuanaco e Inca. En la meseta que est치 cruzando el lago Umayo hay una reserva de vicu침as a la que uno puede acceder por barco con un permiso de dicho lugar. Lo recomiendo mucho sobre todo porque la caminata no es muy cansada y los tour salen por la tarde Aproximadamente a las 2 de la tarde."
5,6 agosto 2017,Lugar de referencia,Excelentes ruinas preincaicas e incaicas que son tumbas funerarias bien mantenidas. Las vistas son maravillosas al Lago Umayo. Importante que un gu칤a explique las diferentes curiosidades.
5,1 agosto 2017,Chullpas de Sillustani ,"Torres funerarias incas rodeadas de un lago incre칤ble que hacen de 칠sta una excelente excursi칩n: cultura, historia y paisaje. Recomiendo ir con gu칤a para conocer lo que se ve.Tienen tiendas artesanales d칩nde comprar en la base del lugar.Al armar el itinerario no lo dejen afuera! Es una excursi칩n de medio d칤a. Se puede ir de ma침ana o tarde. "
4,25 julio 2017,Bello lugar,"Es un lugar bastante tranquilo para visitar. Hice la visita con mi pareja por cuenta propia. Tomamos un taxi que nos llevo a la salida de micros colectivos(dependiendo de la distancia en la que se encuentre su hotel pueden cobrarles entre S/.3 y S/.3.50). De ah칤, no hay ninguna l칤nea que llegue directamente hasta Sillustani, por lo qu칠 hay que bajar en ""el cruce"" y tomar otro colectivo hasta el complejo arqueol칩gico. Todo eso sale alrededor de S/.6. El lugar es precioso, fuimos por la ma침ana y no hab칤a un alma. La vista es espectacular, lindo para hacer un recorrido tranquilo. Ah, cierto, cobran una entrada de S/.15 soles para nacionales y extranjeros, no es mucho y vale la pena. "
5,17 julio 2017,"Genial, y vista exelente.","Un buen tour desde Puno, econ칩mico... en el lugar se pueden adquirir souvenir a muy buen precio, mejores que en la ciudad. El tour puede durar unas 4 horas ida y vuelta; recomendable en ir en la tarde despu칠s del almuerzo, ya que el sol baja y hay menos personas para tomar fotos."
4,16 julio 2017,Muy tradicional,"Llegas a Puno con la unica ilusion de navegar en el lago Titicaca y de repente la ciudad te sorprende con un lugar magico llamado Sillustani, lleno de ruinas arqueologicas, leyendas magicas y personas magicas herederas de una gran civilizacion que no tienen inconveniente en maravillarte con sus historias y tomar lindas fotos. Definitivamente vale la pena, recuerda llevar un buen abrigo por que la brisa es fuerte y fria."
5,9 julio 2017,Lugar m치gico ,Un lugar m치gico entre puno y juliaca. Recomiendo ir en la tarde porque no encontr칠 mucha gente. Una parada infaltable para visitar.
4,6 julio 2017,Un lugar sorprendente,"Este lugar est치 enfocado ala ceremonia f칰nebre se refiere a los cementerios
La vista desde la cima es muy bonita"
5,4 julio 2017,Impresionante vista,"Tom칠 el tour cerca de la plaza de armas, el costo fue de S/.40.00 por persona mi hija de 5 a침os pag칩 S/.25.00, nos recogieron del hotel a las 2pm y nos llevaron al lugar, se viaja aproximadamente 20 minuto. Ya en el punto caminos media a cuarenta minutos cuesta arriba, se demora porque hay paradas en el camino d칩nde te explican la historia del cementerio, de las torres funerarias, etc. Una vez arriba vez un paisaje impresionante del lago Umayo, se siente tanta paz, lo recomiendo mucho, yo viaj칠 con mi hija, la altura no le choc칩 porque le di gravol antes de subir, en el mes de julio ir bien abrigados, al promediar las 5pm empieza los vientos muy fuertes y helados."
4,30 junio 2017,Morada eterna de los Hijos del Sol.,"El Complejo arqueol칩gico de Sillustani es un lugar obligatorio si estas de visita por Puno en busqueda de historia y naturaleza, sus majestuosas tumbas pertenecientes a la cultura Kolla (1200 - 1450) constituyen su principal atractivo, as칤 como la vista al lago Umayo. Recomendable ir de ma침ana y con una buena camara fotogr치fica."
5,30 junio 2017,"Paz, paz y paz...","Al igual que la visita al lago, este lugar te llena de paz, tranquilidad y la buena vibra de la gente que vive ahi."
5,28 junio 2017,Lugar incre칤ble y m칤stico,"El complejo arqueol칩gico de Sillustani tiene unas incre칤bles vistas junto al lago Umayo, donde pueden verse varias islas donde anidan especies de p치jaros. Las chullpas est치n muy bien conservadas. Por suerte cuando estuve con mi grupo no hab칤an demasiados turistas, lo que le otorga un cierto encanto al lugar.Diariamente salen buses a Sillustani desde Puno a las 14.30 horas por unos S/ 30, dejando a los visitantes una hora en las chullpas. Una opci칩n m치s econ칩mica es tomar buses que van a Juliaca (S/ 5) y pedir que les bajen en la bifurcaci칩n a Sillustani.El lugar merece la pena."
3,22 junio 2017,Decepcionante,"Llegamos ech치ndose la noche y la visita no fue muy agradable ya que la bajada la tuvimos que hacer de noche
Imagino que en otras condiciones hubiera tenido otra percepcion"
5,19 junio 2017,No puedes perdertelo!,"He visitado varias cosas en Puno, pero esta fue mi favorita.Es un centro arqueol칩gico que se encuentra como 40 minutos de Puno en auto.Yo tom칠 un tour. Me cost칩 30 soles (cada adulto y 15 mi hijo de 9 a침os) y duro casi 3 horas.La gu칤a tur칤stica fue muy amable y nos explico que los monumentos eran tumbas y que se hab칤a encontrado desde 1 persona en la torre principal hasta 34 cuerpos en una tumba corriente.Se cree que era a partir del rango o lo importante de la persona la cantidad de cuerpos con los que los sepultaban.Tambi칠n encontraron oro Inca y est치n en el museo de Puno.Est치 a 4.000 metros de altura, as칤 que caminen lento, lleven agua y ropa especial para el viento, ya que corre mucho arriba.Yo sub칤 con 7 meses de embarazo y pude subir despacito. Adem치s sub칤 junto a mi esposo e hijo de 9 a침os. Con esto les quiero decir, que cansa subir por la altura, pero se puede.Tambi칠n hay artesan칤a para comprar a la gente local. Y ocupar el ba침o cuesta 1 sol.Puedes ver el lago umayo que es realmente hermoso.Es a mi gusto, lo que m치s me ha gustado de Puno."
4,16 junio 2017,Un sitio arqueol칩gico con atardeceres espectaculares ,Este sitio arqueol칩gico tiene una vista excepcional y paisajes 칰nicos a parte que es los habitantes que habitaron esa zona son pre incas adem치s las construcciones est치n impresionantes el costo es de 25 soles y si van en invierno es recomendable llevarse ropa abrigadora
4,11 junio 2017,"Muy Interesante, preferible al atardecer","Est치 ubicado a 40 minutos de distancia en auto del centro de la ciudad de Puno, nosotras contratamos una excursi칩n. El lugar me gust칩 mucho, no demasiado turismo. La visita de las chullpas muy interesantes y las vistas con el atardecer del lago del lago Umayo y del paisaje circundante."
4,8 junio 2017,Retorno al Aeropuerto,"De todas maneras si tienes un vuelo al mediod칤a o 13:00 hrs es recomendable que est칠s vistandolo aproximadamente a las 11 am, unas vistas geniales super tranquilo las construcciones son buenas y te permiten fotos muy buenas, luego con calma puedes ir al aeropuerto lo recomiendo de salida de Puno por su ubicaci칩n. "
5,7 junio 2017,lindo atardecer,"Un lugar maravilloso para las personas que gustan de la naturaleza, se puede observar la puesta del Sol, vicu침as en la isla que esta frente a la pen칤nsula, muy bonito."
4,30 mayo 2017,HISTORIA QUE HABLA,Imponentes restos arqueol칩gicos que hablan por s칤 mismos y muestran la grandeza de una civilizaci칩n ancestral
5,28 mayo 2017,Una vista hermosa,"Camino al aeropuerto de Juliaca pasamos a sillustani es un tour de 2 horas aproximadamente que vale la pena hacerlo, en nuestro tour a isla de uros iba incluido, solo checa bien a que hora sale tu vuelo para que puedas llegar con buen tiempo. Sillustani son unas tumbas cil칤ndricas de la cultura pre-inca con una vista al lago Umayo incre칤ble."
4,27 mayo 2017,Bueno,"Sillustani tiene como mayor atractivo el templo de los Falos, esculturas en piedra de la 칠poca Inca representa al miembro genital masculino.Pero lo que m치s me gusto de este lugar y volver칤a por eso, es la comida...en la plaza del distrito hay restaurantes que te ofrecen Trucha...la mejor trucha al ajo que prob칠."
5,19 mayo 2017,Vistas impresionantes,"Est치 ubicado a 40 minutos de distancia en auto del centro de la ciudad de Puno. Hay que hacer una caminata de subida al lugar donde est치n las chullpas (y es recomendable llevar ropa abrigada, pues corre mucho viento); y desde all칤 se tienen excelentes vistas del lago Umayo y del paisaje circundante."
5,30 abril 2017,Recomendable,"El kago cuando vas avanzando y subes es impresionante, con paisajes misticos. Es impirtante ir con paraguas o poncho de agua. Las chulpas estan llenas de historia, contraten guia a la entrada."
5,27 abril 2017,buenaso,es bueno para visitar con los parientes amigos solo en la tarde es de 14:00 p.m a 18:00 p.m es buenaso
5,20 abril 2017, Vale la pena la caminata,"Sillustani esta entre Juliaca y Puno , es muy f치cil de llegar se puede tomar un colectivo de Puno a Juliaca o viceversa el pasaje esta S/.3.00 se bajan en el desv칤o a sillustani de ese punto de toma otro colectivo S/. 3.00 - S/. 4.00 hasta el sitio arqueol칩gico de Sillustani, el ingreso para universitarios esta S/. 5.00 y S/. 10.00 el ingreso general. El recorrido se puede hacer sin gu칤a (no se olviden de pedir su cartilla de 칤nformacio al ingreso) todo esta muy bien explicado, el recorrido es sencillo solo se complica la subida, es un poco agitada . Recomiendo ir en la ma침ana para ver mejor el paisaje, yo fui ennla tarde y corr칤a mucho viento y hacia mucho fr칤o. No se olviden que las chillas de sillustani salen en las monedas de colecci칩n de 1 nuevo sol. "
5,17 abril 2017,gran vista de la laguna Umayo,"un lugar magico lleno de energia rodeado por una laguna llamado umayo, se dice que este fue un cementerio inca. un lugar lleno de misterios."
5,14 abril 2017,Hermosas vistas.,"Sillustani es un lugar rodeado del lago Umayo, y por las vistas espectaculares del lugar se entiende el por qu칠 fue elegido como lugar de entierro desde la 칠poca pre inca. Los transportes tur칤sticos dejan en una parte que se puede decir baja para luego subir una monta침a, la caminata toma unos diez minutos en subida. En la parte superior se encuentran las famosas Chullpas pre incas e incas, siendo est치s 칰ltima las mejores por sus dise침os y acabados. Desde la parte superior se observa ese paisaje espectacular que no se pueden perder. En el trayecto de la caminata se pueden adquirir artesan칤as. Eso s칤, tienen que llevar protecci칩n contra el sol que quema. En horas de la tarde es a mi parecer el mejor momento para acudir y poder apreciar la belleza de un atardecer en ese majestuoso paraje."
5,12 abril 2017,Lugar magico,"Un lugar muy agradable, tranquilo y silencioso como todo cementerio. El lago es de otro planeta quedas loco al verlo."
4,28 marzo 2017,sillustani y sus chullpas,"fui de bicleteada con la agencia INCALAKE desde el desvi칩 a sillustani y fue hermoso fue un dia soleado y llegar hasta las chullpas, conocer un poco de la historia de estas chullpas maravilloso y con una preciosa vista de un peque침o lago muy bonito en el mes de febrero"
4,26 marzo 2017,Torres funerarias (Chullpas),"Est치n alejadas de Puno, pero pueden visitarse en una excursi칩n de medio d칤a. Se encuentran en unas colinas onduladas del lago Umayo."
5,21 marzo 2017,Impactante,"Recomiendo visitar este sitio en el trayecto desde Juliaca a Puno, al hacerlo ni bien se aterriza no se siente el afecto de la altura aun, ademas asi queda tiempo si uno esta 2 noches alli para hacer la excursion de dia entero a Uros y Taquile, y la tarde de la llegada para descansar y aclimatarse"
5,15 marzo 2017,Sitio M치gico al atardecer,Esta visita es accesible desde Puno y merece la pena una escapada. Vistas preciosas a lagos y sitio arqueol칩gico muy interesante.
5,15 marzo 2017,Incre칤ble ,"Sillustani es un sitio arqueol칩gico, que tiene cementerios donde se pueden ver una serie de impresionantes tumbas pertenecientes a la cultura Kolla. Es un sitio muy lindo para visitar, un imperdible si vas a Puno. Si quieres puedes tomar un tour que sales alrededor de 40 soles o puedes irte por tu cuenta, tomas una combi que va de Puno a Juliaca y te bajas en una intersecci칩n donde hay un letrero gigante que dice Sillustani, ah칤 tomas un taxi que te lleva al sitio arqueol칩gico. Yo lo hice as칤 y me sali칩 todo como 25 soles, son 15 soles de entrada."
5,11 marzo 2017,espectacular,"muy bonita experiencia cerca a una espectacular laguna, el sunset es incre칤ble y m치gico, el gu칤a fue muy bueno. Nos vamos muy contentos con la visita."
5,5 marzo 2017,"Adorable, colorido, un lugar de ensue침o!!!","Te enamora!!!! desde que tocas sus m치gicos juncos!! Su cari침o, sonrisas y festival de color te envolver치n con su m치gica calidez. Un lugar inolvidable y 칰nico para disfrutar en armon칤a y sincron칤a con la naturaleza."
5,1 marzo 2017,Hermoso lugar,"Recomendable de todas maneras tienen que visitarlo, fui con mi ni침a de 2 a침os y no tuvimos problemas se camina pero no mucho..hay estacionamiento y si van con carro propio aprovechen en hacer el Tour vivencial..en el desvio para entrar a Sillustani hay casas donde las familias esperan recibirlos, les muestran sus telares, les hacen probar los diferentes tipos de papas, etc...linda experiencia.."
5,1 marzo 2017,Espectacular,"Se puede ir con un agente de turismo (S/.35) pero van a partir de las 2pm o puedes contratar un taxi que te lleva mas temprano, espera 2 horas y te regresa. Sale a cuenta si son 4 o 5.(S/.100). Si deseas hay gu칤as, debes llevar una buena c치mara de fotos porque las vistas de las chullpas y del Lago Umayo son espectaculares. Llevar gorro, lentes y ponerse bloqueador, el sol es fuerte. Con dos horas es suficiente. Llegu칠 a la 1 y a las 3 nos retiramos justo cuando llegaban las vans con turistas y junto con ellos la lluvia luego de gozar de un inclemente. No perderse esta visita."
5,1 marzo 2017,Grandes tumbas y una vista excelente,"Ten a mano tu chalina, una buena casaca para el fr칤o y tu c치mara. Es un gran lugar para conocer esta zona de tumbas. Con muy bonita vista. Recomiendo asegurar que el tour tenga una gu칤a para que te explique la zona. Generalmente el pasaje del tour incluye la el pago para ingresar. Si te olvidaste de los guantes o una polera para el fr칤o, al ingresar hay algunos puestos que venden estos imprescindibles para el fr칤o. Tambien hay un ba침o en una casa al inicio donde pagas un sol para poder usarlo.Si estas en Puno debes ir a conocer esta hermosa zona."
5,24 febrero 2017,Hermoso Paisaje,"Este sitio es una cerro el cual se recorre a Pie , el camino es breve pero un poco duro por la altura pero recompensado por un Hermoso Espect치culo, desde las altura y en medio de las Chullpas (despensas hecha en piedra similares a las torres de ajedrez de 25 a 20 metros) pueden ver una laguna hermosa que domina toda esa zona"
