rating,date,coment_title,coment_description
5,3 noviembre 2015,Si vas a Puno Sillustani es imperdible!!,"Visitar치s las ""chulpas"" Tiahuanaco e Incas; formas de enterrar a sus muertos en estas culturas prehisp치nicas y siempre con majestuosos paisajes de otros lagos como fondo. Adem치s hay un muy variado mercado de artesan칤as en la parte inferior del complejo."
5,3 noviembre 2015,Energ칤a,"Es un lugar lleno de mucha energ칤a, posee vistas hermosas, no es dif칤cil llegar sin embargo para este caso es mejor coger un operador tur칤stico, a mi me cobraron 28 soles y fuimos un grupo de 7 personas. nos cogi칩 una lluvia incre칤ble pero el paseo se mantuvo genial."
4,2 noviembre 2015,Bello Lugar,"Est치 cerca de la ciudad como para ir en una ma침ana o una tarde, de preferencia en las ma침anas por el fr칤o intenso de la altura, all칤 podr치n ver las tumbas de Sillustani donde los pobladores enterraban a sus familiares, tambi칠n hay unas magn칤ficas vistas a unas lagunas azules como el cielo y unos paisajes de cuadros."
4,28 octubre 2015,Lugar m칤stico con un excelente paisaje,"Asist칤 con mi pareja en la tarde, 3pm aproximado. La caminata con el grupo se hizo de manera pausada debido a la exigencia de la altura, pero se aprovechaba cada punto de descanso para una buena explicaci칩n sobre la historia del lugar. Altamente recomendado por la grandiosa vista del lago y de las chulpas. Excelente sitio para respirar aire puro y para unas buenas fotos."
5,27 octubre 2015,maravilloso,"Las tumbas son incre칤bles y su historia tambi칠n, un lugar lleno de energia, paz y con impresionantes vistas de la geografia altiplanica. nos recomendaron visitar este lugar y valio la pena."
4,26 octubre 2015,Se respira paz y trabajo en equipo,"Hermoso lugar para disfrutar del viento y del paisaje del Titicaca, las chulpas majestuosas, gente muy atenta, recomiendo visitarla en febrero por sus carnavales."
4,26 octubre 2015,Hay que visitarlo,"Ir en la tarde es un poco duro por el viento frio, pero igual se siente la energia especial de este sitio. Las Chullpas y el Lago Umayo Impresionantes. La proxima vez vendre temprano en la ma침ana dice que se puede tomar un bote a motor para conocer la Isla donde hay vicu침as."
4,26 octubre 2015,Vista espectacular,Algo muy distinto a lo que normalmente se ve en las ruinas Inca. Sillustani es espectacular al atardecer.. la vista del lago que se encuentra en la parte posterior es la mejor forma de finalizar el tour.
4,24 octubre 2015,Excelente vista,Llegamos por la tarde y tuvimos una espectacular vista de la puesta de sol: un lugar en el que la historia y la naturaleza se juntan. Es un lugar con mucha paz y energ칤a. Las Chullpas son impresionantes. Se requiere estar en forma pues hay que subir y bajar escaleras en las ruinas teniendo en cuenta que la falta de ox칤geno por la altura.
5,21 octubre 2015,Vista increible,"Se debe realizar una caminata de un poco menos de una hora para poder ver el tremendo paisaje, vale al 1000% la pena!"
5,15 octubre 2015,ambiente fr칤o pero hermoso,"SIEMPRE QUISIMOS VER LAS CHULLPAS. La vista es hermosa el aire puro y fr칤o reconforta, se repira paz y tranquilidad. Un encuentro con el pasado"
5,14 octubre 2015,Maravilloso,"Es un lugar m치gico, especial que condensa toda la energ칤a y sabidur칤a ancestral, permitiendo no solo conocer la historia, sino tambi칠n toda su magia y poder"
4,13 octubre 2015,Muy Bueno El Lugar,"Tiene una laguna fascinante, una tarde agradable por Sillustani, el clima por la tarde algo duro para los que venimos desde las Costas pero el Lugar lo vale."
4,13 octubre 2015,Excelente!,Una isla que debes visitar s칤 o s칤 en Puno. Llega hasta la cima para tener una vista incre칤ble de todo el lago Titicaca.
5,7 octubre 2015,Impresionante,"Es un lugar m칤stico se siente el ambiente energizado, llegamos a las 5:30 de la ma침ana. Vimos el amanecer es una experiencia sin igual. se escuchan los patos y el saltar de los peses en la laguna. los paisajes son impresionantes"
4,1 octubre 2015,Un verdadero legado de nuestra historia,"Me encanto la visita a las ruinas, una gran vista hacia una isla que se encuentra al frente y el contacto con la naturaleza.Lo que no me gusto fue la falta transporte para regresar del lugar, puesto que se tiene que esperar alg칰n auto o veh칤culo para regresar a la carretera. "
4,30 septiembre 2015,SITIO ARQUEOLOGICO,"Se pueden ver diferentes restos de la Cultura Inca, el Tour es Guiado por personal que tiene buena informaci칩n, venden objetos de recuerdo, llevar gorro y protecci칩n para el sol."
5,28 septiembre 2015,Un lugar m치gico!,"""Es un lugar con una vista impresionante, guarda mucha historia y gran misterio, una experiencia muy linda, este sitio arqueologico no puede faltar en su visita por Puno.
Sin lugar a dudas fue una excelente decisi칩n visitar este lugar, es bello...sin palabras"""
5,27 septiembre 2015,Unicas y recomiendo su visita,"Recomiendo la visita ya que no se encuentra dentro de los tours estandar. La vista, las tumbas el emplazamiento es excelente."
5,27 septiembre 2015,Lugar encantador y bello!,"Al llegar a la entrada principal de Sillustani se aprecia en la cima las Chullpas funerarias, se siente el esplendor de las culturas ancestrales, de los Collas y los Incas, cuan h치biles e ingeniosos fueron al construirlos en esta pen칤nsula. Me encanto mucho se siente la altura al llegar a la parte de arriba pero una vez all칤 y a apreciar su laguna uno olvida que est치 a m치s de 4 mil metros. Encantador y energ칠tico!"
4,23 septiembre 2015,Cementerio de altura,"Un lugar arqueol칩gico donde se encuentran las Chullpas de Sillustani, antiguo lugar donde enterraban a las momias de la Cultura Tiahuanaco y despu칠s en el Qollasuyo de los Incas."
4,23 septiembre 2015,Imponente,"Preciosa vista y sitio arqueol칩gico! si llegas en avi칩n (a Juliaca) recomiendo hacerlo camino a puno, ya que queda a mitad de camino entre Juliaca y Puno y no toma mucho tiempo en recorrerlo, eso si tomarlo con calma! ya que de por si Puno tiene gran altura y para subir a ver la Chullpas (tumbas) hay que subir una colina, arriba no solo encontras una hermosa vista al Lago Umayo sino tb un centro arqueol칩gico lleno de historia."
4,19 septiembre 2015,Interesante,"Vale la pena visitarlo. Muy recomendable hacerlo al llegar, pues est치 a medio camino entre el aeropuerto y la ciudad de Puno. Es una visita de poco m치s de una hora con lo que se puede hacer perfectamente a no ser que ya se aterrice en el aeropuerto cuando ya se ha puesto el sol."
4,18 septiembre 2015,"Sillustani, Visita Obligada en Puno","Se puede tomar el tour desde la Plaza de Armas los buses salen desde las 14 horas, esta cerca a la ciudad, la explicaci칩n del gu칤a es buena, se debe llevar bloqueador solar, lentes de sol y ropa abrigadora, tiene una hermosa vista desde la cima, para las fotos empiecen por los lugares alejados para no esperar demasiado por la locaci칩n despejada. "
5,17 septiembre 2015,Muy bonito!,"El tour iniciaba en la tarde, no esta muy lejos de la ciudad de Puno. En el lugar hay una laguna y un lago que brindan un paisaje sumamente impresionante.
Las construcciones son grandes y bonitas, los gu칤as conocen bien la historia, esta bien se침alizado."
5,16 septiembre 2015,Lindo lugar,"Sillustani aunq no es un lugar grande, es grande x sus hermosos paisajes, energ칤a y su historia. Un lugar imperdible."
4,15 septiembre 2015,Increible vista,"Sillustani cuenta con una increible vista, en la ma침ana hace sol y por la tarde comienza a correr aire frio y la temperatura es alrededor de 10춿"
5,15 septiembre 2015,MARAVILLOSO,"Hace tiempo que visite este centro historico, y hace un par de meses lo encontre totalmente cambiado la remodelacion y las ganas de mantener el legado historico me dejjo realmente impactado, es como retroceder en el tiempo y ver como realmente eran ya no es un lugar de solo ruinas ahora es un lugar totalmente remodelado.. recomiendo visitarlo"
5,15 septiembre 2015,No se puede dejar de visitar,Interesante y hermoso lugar que no se puede dejar de visitar y conocer mucho de la historia del Per칰....lo recomiendo!!!!!!
4,13 septiembre 2015,Fotasos,Las fotos que puedes sacar son geniales. Me gusto mucho porque en la meseta hacen actividades m칤sticas y llama mucho la atenci칩n
5,12 septiembre 2015,sillustani,la isla de sillustani bello lugar y esplendido las artes y los lugares de la naturaleza con arqueolog칤a antigua
5,10 septiembre 2015,VISITA ARQUEOLOGICA,En lo posible se debe ir en la ma침ana porque no hay mucha gente. El lugar tiene una muy buena vista al lago Umayo. Se puede ir solo o con un gu칤a.
5,9 septiembre 2015,Uno de los grandes atractivos que tiene Puno,"Si van a Puno, este es un lugar que no deben dejar de visitar, Est치 en muy buen estado de conservaci칩n, los caminos de acceso a la zona est치n en perfecto estado y lo mejor la vista desde la parte superior de la zona, un lugar donde te puedes quedar por mucho rato en una tranquilidad total. Recomendable.Saludos!!!"
4,6 septiembre 2015,Maravillosa experiencia,"Fue nuestra ultima recalada en nuestro viaje por PERU Y BOLIVIA y tenia muchas ganas de ir , no nos daban los tiempos , y no se como , le encontramos la vuelta en nuestro regreso al aeropuerto de JULIACA , ( esta en el camino ) y llegamos a verlas al atradecer y terminamos de recorrelas ya casi al anochecer y nos guiamos por las luces de las estrellas , cr칠annos , fue una experiencia sumamente energizante , Nos fascino fue el broche de oro para este viaje."
5,4 septiembre 2015,Vale la pena visitarlo,"Fui a Sillustani ilusionada de conocerlo y no me decepcion칩. Para ir, puedes tomar una combi hasta el desv칤o a Sillustani por S/ 3.50 y de all칤 tomar un colectivo o taxi por 4 soles. Otra opci칩n, si est치s en grupo grande como en mi caso, rentar una combi en el terminal en la avenida La Torre, a una cuadra del hostal Totorani. El paisaje hacia Sillustani es muy bonito, para fotos. Al llegar, uno se encuentra con un amplio complejo arqueol칩gico donde se encuentran las famosas chullpas. Estas se hallan en muy buen estado; algunas son inmensas e impresionan. Recorrer el complejo vale la pena. Hay un lago dentro y en el medio una isla cuya meseta sorprende. Tranquilamente puede invertirse medio d칤a en el paseo. Depende de cu치nto quieras recorrer Sillustani."
5,3 septiembre 2015,Buena experiencia,"El camino a sillustani es un poco largo. Y despues hay que hacer una caminata que es un poco cansada. Si van en epoca de lluvia, no olviden llevar ponchos impermeables para la lluvia, ya que llega de un momento a otro y es muy fuerte, a mi esposo y a mi nos cogi칩 la lluvia y olvidamos el poncho y terminamos totalmente mojados. De todas maneras, los paisajes son muy lindos. Valio la pena ir."
4,1 septiembre 2015,Chulpas,Las chulpas est치n en muy buen estado. El camino es accesible aunque hay que tomarlo con calma debido a la altura a la que se encuntra.
5,30 agosto 2015,VISITA A SILLUSTANI,"Es un lugar hist칩rico muy hermoso, la gente acogedora y con las facilidades de acceso para el turista."
5,29 agosto 2015,En busca de historia,"Excelentes vestigios de las chullpas, con un paisaje fascinante. Los incas que eligieron Sillustani lo hicieron sabiamente para sus tumbas."
5,27 agosto 2015,Un incre칤ble lugar! Arqueolog칤a fascinante!,"Pienso que este lugar es uno de los sitios que uno no puede dejar de visitar en Per칰. Siempre tuve inter칠s en conocer las chullpas de Sillustani. Son emblem치ticas. Y verlas en directo, pues, son incre칤bles. es parte del pasado de la historia antig칲a de Per칰.Hay que tomar un tour para visitar este sitio. Nos cost칩 35 soles. Y en el mismo hospedaje nos dieron la informaci칩n tur칤stica respectiva."
4,25 agosto 2015,Chulpas de Sillustani,"Corre bastante viento pero la vista es muy bonita, ves varias chulpas cerca una de la otra, tienes vista al campo y al lago. El camino est치 se침alado con piedras peque침as as칤 que se debe tener cuidado al pisar, como es altura es recomendable subir despacio y con cuidado. Los tours para este sitio son a las 2pm as칤 que ademas de llevar bloqueador hay que estar abrigados por todo el viento y el fr칤o extra del atardecer. Tienes un camino muy bonito y puestos en el camino para llegar a la entrada a las chulpas, venden varios souvenirs a buen precio."
4,21 agosto 2015,Hermosas vistas escenicas,"Excelente lugar arqueol칩gico, con hermosas visuales, muy importante contar con un buen gu칤a que te permita apreciar el lugar en todas sus dimensiones. Inolvidable"
5,21 agosto 2015,"Un paisaje espectacular, imperdible","Lo m치s bonito que he visitado en Puno, el paisaje es alucinante y hermoso para deleitar y poder tomarse fotos. Las tumbas son incre칤bles y su historia tambi칠n, vale mucho la pena este tour."
4,20 agosto 2015,Cultura e historia precioso!!,"Las chullpas de Sillustani se encuentra a 1 hora aprox de la ciudad de Puno. El tour te cuesta 30/35 soles. Un tour que dura entre 3/4 horas pero que vale la pena conocer.Es un lugar muy bonito para conocer, que incluye historia de las culturas preincas pasadas y su forma de vivir. Tambi칠n enxuenrras lagunas y paisajes muy bonitos. "
4,20 agosto 2015,mucha energia,"Un lugar de mucha energia para todos los que pueden visitar este magnifico lugar, con un hermozo lago al rededor de este centro arqueologico"
5,19 agosto 2015,Mistico,"Excelente lugar Mistico, llegas por un desvio de la carretera Puno -Juliaca a 30 km, en el camino tienes la opcion de hacer turismo vivencial ya que los lugare침os te ofrecen sus casas a S/.25 soles por cama,"
5,17 agosto 2015,una sorpresa,"Solo costo S/.35 el tour (VAN + guia) con previa parada en el mirador de puno.Llegeando a sillustani solo se caminan 20minutos en subida y con guia 20 minutos mas mientras cuenta la historia del lugar.En la cima, luego de ver las chullpas, la vista es lo mejor... los colores que se crean al atardecer entre el lago y la meceta verde del frente provocan tomar miles de fotos"
5,13 agosto 2015,Incre칤ble vista!!!,"Es un incre칤ble lugar para tomar fotos, tanto con la laguna como con las chullpas, 100% recomendable. Es preferible tomar un tour, ya que en el camino te hacen visitar una casa t칤pica de la zona, donde se puede apreciar la forma de vida de las personas de la zona y probar su comida."
5,13 agosto 2015,Testimonio inca y preinca a una hora de Puno,"Una excursion cerca de Puno. Por el camino se disfrutan de una vista fantastica al Lago Titicaca. El sitio arqueologico muy interesante, y el entorno 칠s un paisaje fabuloso!"
5,12 agosto 2015,Sillustani enigmatico,me gusto el paisaje donde escogieron construir sus tumbas y sorprende que las construcciones funebres de distinta epoca esten dirigidas todas hacia el mismo punto cardinal...no me gusto ir el dia que llegue a Puno porque no me permiti칩 aclimatarme como para subir hasta los 4000 m
5,10 agosto 2015,Un viaje al pasado!,"Sillustani qued치 a una hora aprox de Puno, puedes contratar los tours de la plaza de armas de Puno. Llegando hay una caminata cuesta arriba de 20 minutos, que pone a prueba el pulm칩n si es que no eres de la zona. Es recomendable ir al segundo o tercer d칤a.Llegando logras ver las tumbas reales, maravilloso, paisaje que se combina con la vista a la meseta en la laguna. Muy bonito para los ojos!!!!"
5,6 agosto 2015,Impresionante,"Esta ruinas, ubicadas en un entorno maravilloso, son realmente impresionantes, una muestra del poder칤o y majestuosidad de las civilizaciones de nuestros ancestros."
4,6 agosto 2015,Las Chullpas de Sillustani son un lugar interesante,"Este lugar muestra las chullpas construidas en la 칠poca incaica como tumbas, o como lugar para almacenar alimentos, es muy interesante verlas y est치n situadas al lado de un lago peque침o, pero muy hermoso."
3,4 agosto 2015,Una buena experiencia,"El tour cuesta 40 soles por persona la mayoria de agencias estan en la calle lima. se llega al recinto para luego caminar 30 minutos inlcuyendo paradas hasta llegar a las famosas chullpas (cementerio) alfrente de ellas esta un paisaje muy bueno donde apreciamos una laguna, lugo descendemos por un sendero para el retorno a puno en el camino podras visitar casa de familias de lugare침os donde puedes ver su forma de vida y una degustacion de productos andinos algunos nativos. Muy buena experiencia"
5,3 agosto 2015,Buen ligar para vivitar,"Aunque el lugar esta muy bien cuidado, limpio y conservado. Lo que falta es un poco de seguridad, personas que verifiquen que se cumplan las rutas establecidas ya que hay algunas personas que se pasan de la ruta permitida."
5,3 agosto 2015,Chullpas,"Es una maravillosa visita antes de llegar a Pu침o , se muestra la impresionante Meseta del Collao con el Lago Unaya en todo su esplendor!!!!"
5,3 agosto 2015,BUENAS VIBRAS - ENERG칈AS,"De buenas vibras, para conocer un poco mas de la cultura peruana - los incas excelente vista con un buen gu칤a lo conoces mejor"
5,3 agosto 2015,Sillustani incre칤ble,"Vistas espectaculares!!!...personas muy amablesencillo, lindas cosas para comprar...satisfecha con la visita."
5,2 agosto 2015,es como me lo contaron hermoso lugar,fue una grata visita gente amable y el lugar de sillustani lindo con sus impresionares chullpas y bien trabajadas definitivamente so antecesores de los incas paraje definitivamente recomendado para pasar unas buenas vacaciones y cargarse de energ칤a
5,1 agosto 2015,Espectacular,"Impresionante, no solamente las ruinas, sino todo el paisaje en s칤. Mucho mejor de lo que se ve en fotos."
4,1 agosto 2015,Lugar hermoso,"Las Chullpas de Silustani son un sitio recomendable para visitar si est치s en la zona de Puno. Me gustaron mas que las Islas de Uros.
Tiene unas vistas preciosas y el lugar es super tranquilo."
5,30 julio 2015,Incre칤ble,"Hermoso lugar, con paisajes indescriptibles, cuenta con una vista incre칤ble y una historia conmovedora como tantos otros lugares de Per칰."
5,30 julio 2015,Lugar a visitar,"Interesante historia sobre como enterraban los incas en estas chulpas. Muy cerca a la ciudad de Puno, como 30 minutos."
4,30 julio 2015,Interesante tour,"Este es uno de los primeros tours que haces al llegar al aeropuerto (si es que se tiene el tour contratado), el lugar es lindo e interesante por la importancia del lugar y por ser un lugar representativo en Peru, salen hasta en las monedas =). La vista tambi칠n es linda, rodeada de lagunas."
4,26 julio 2015,Maravilloso,"Visit칠 el centro arqueol칩gico de Siyustani, tiene unos paisajes hermosos y una gran historia por ense침ar. Uno puede conocer las costumbres de los pobladores aleda침os. Recomiendo ir en zapatillas, bien abrigados y no olvidar una botella de agua y bloqueador ya que se camina por alrededor de 40 minutos. "
5,24 julio 2015,una laguna impresionante,Ademas de las chulpas es impresionante el algo Umayo que se encuentra en Sillustani. Vale la pena subir hasta 4000 msnm.
5,23 julio 2015,Excelente,"Los monumentos son impresionantes y el paisaje es hermoso , los invito a que visiten sillustani una experiencia inolvidable"
5,23 julio 2015,Una maravilla,"Este lugar nos pareci칩 espectacular.
Andan antes de las 2pm, por que a partir de esta hora llegan los micifuces con todos los turistas."
4,23 julio 2015,Caminata,"Para los que no gustan de la caminata... mejor no bajar del bus, pero se perder치n una linda vista. Llevar desde ah칤 abrigo pues se siente mucho viento."
5,22 julio 2015,impresionante,"un lugar magico hermoso con una vista privilegiada para tomar fotos, generalmente se visita por la tarde, esta lleno de tumbas las agencias te llevan a visitar un pueblo cercano que es muy lindo recomiendo la visita de este lugar en puno"
5,17 julio 2015,Ir de Puno a Sillustani,"Para conocer Sillustani, puedes tomar los buses que salen del terminal Villa Fatima de Puno hacia Juliaca y por S/. 3.50 te llevan al desvio de Sillustani, en el desvio hay colectivos hacia Sillustani, por S/.4 te llevan hacia alla y la entrada al complejo es S/10 adulto y S/5 estudiante, recuerda que para regresar debes esperar un colectivo, o haber pactado que te esperen."
5,13 julio 2015,Ex칩tico cementerio parque de la cultura Kolla desde el siglo XIII.,"A 33 km de la ciudad de Puno, provincia de Lampa, en una pen칤nsula de la hermosa laguna Umayo, se encuentra el sitio arqueol칩gico de 랇as Chullpas de Sillustani. Es un cementerio donde se ven una serie de impresionantes tumbas (chullpas o ayawasis; casas de los muertos), pertenecientes a la cultura Kolla (1200-1450), que se desarroll칩 en la parte norte de la laguna (3.850 msnm), en la localidad conocida como Hatuncolla. Llama la atenci칩n llegando a la zona, las viviendas de las chacras circundantes, muchas de ellas dedicadas al turismo rural. El sitio de la necr칩polis, por la belleza del paisaje en el que est치 enclavada, podr칤a pasar por un actual y ex칩tico cementerio parque. Una chullpa, es una antigua torre funeraria Aymara, de base angular o redonda, construida originalmente para personas de alto estatus en las culturas Aymara y posteriormente incaica. La chullpa m치s representativa del sitio, la de mayor altura -12 metros-, se conoce con el nombre 띿el lagarto, por su figura tallada en la piedra y que desgraciadamente est치 muy deteriorada. Las chullpas del altiplano, est치n asociadas a los reinos o se침or칤os Aymaras que habitaron desde Canas y Canchis en Per칰, hasta el departamento de Potos칤 en Bolivia. La hermosa geograf칤a de la laguna, que despierta todos nuestros sentidos, seguramente fue una de las razones que impulsaron a los Aymaras a elegir este sitio para honrar a sus muertos. Un imperdible en la ruta entre Puno y Cuzco!!!"
3,11 julio 2015,Muy diferente,"Es una excursion de media jornada en un lugar muy accesible. Las tumbas son 칯nicas, tanto como el punto de vista desde la cumbre."
4,10 julio 2015,Magico!!,"Es un lugar en el que disfrutas cada paso que das, ya que tiene una vista excepcional. Ademas de que es muy interesante que las brujulas no funcionen. El camino hacia las ruinas es muy entretenido porque hay variedad de puestos con pintorescas artesanias. Las ruinas son diferentes a lo que yo habia visto con anterioridad y muy interesantes."
5,9 julio 2015,precioso lugar,"si bien es cierto que se camina una distancia prudente a la cima, la vista panoramica que tendras al final valdra la pena , veras diversidad de chulpas y bellos manantiales , uno de ellos con una peque침a meseta en el medio."
5,3 julio 2015,Bello paisaje!!!,"Bello paisaje acompa침ado de ruinas arqueologicas. Aunq sientan calor al momento de bajar del vehiculo, lleven sus casacas, al regreso se siente mucho frio!"
3,2 julio 2015,Ruinas hermosas,"Me encantaron las ruinas de sillustani. Totalmente recomendables!!!
Si vas a Puno, no te las podes perder, quedan cerca, pero no para ir caminando."
5,1 julio 2015,"Si vas a Puno, tienes que ir a Sillustani","Queda cerca de Puno (Puedes ir en tour o si son varios alquilar un taxi o minivan) La vista de otro lado del Lago Titicaca es maravillosa, recibir el atardecer ah칤 es para nunca olvidarse (Adjunto foto)"
4,30 junio 2015,"Sin ser las mejores ruinas, si vas a Puno vale la pena llegar.","No son las ruinas mas grandes que haya visto, el lugar no es tan grande, pero queda cerca de Puno. (Por 60 soles un taxi nos llevo, nos espero y nos trajo de vuelta). Est치n muy altas, y la falta de oxigeno se nota . Hay un lago que se ve una vez que uno esta arriba que es espectacular por lo imponente del paisaje."
5,30 junio 2015,Aventura al pasado,"El complejo arqueol칩gico sin igual ,con una vista incre칤ble del lago umayo de fondo ,todas las instalaciones muy cuidadas y limpias ,pero lo malo que no ten칤an habilitado el museo y los guardias nada colaboradores ya que no pudimos conseguir un gu칤a y tuvimos que acudir a ellos. recomiendo este lugar pero con un gu칤a ."
5,28 junio 2015,Centro energ칠tico,Es un lugar hermoso y energ칠tico. Vale totalmente la pena ir y tomar muchas fotos. Corre viento as칤 que hay que abrigarse.
5,24 junio 2015,Bonito,"Realmente es un lugar incre칤ble, el gu칤a nos explicaba en ingles y en espa침ol, yo compre este tour en el hostel que me quede."
5,22 junio 2015,viaja con esta empresa,"en una experiencia unica, estar entre las tumbas de los inkas, ver parte del antiguo Per칰, su cultira y vivencias de aquellos a침os."
5,22 junio 2015,Lugar Maravilloso,"Visite Sillustani en mi viaje a Puno, tiene una arqueologia interesante muy aparte de eso la vista es hermosa, la laguna Umayo es maravillosa, les recomiendo visitar este lugar, les aseguro que tendran una experiencia inolvidable"
4,17 junio 2015,Interesante,Muy interesante para entender otras culturas y porque erig칤an esos monumentos funerarios. El paisaje muy agradable . Coincidi칩 que el d칤a que fuimos hab칤a una fiesta y todos iban con vestidos tradicionales de gala .
5,11 junio 2015,Una vista que te quita el aliento,"El lugar esta bien cuidado y cuenta con servicios a la entrada del monumento, as칤 que solo queda disfrutarlo y recorrer sus imponentes chullpas."
5,10 junio 2015,Silustani y Laguna Umayo,"Comienza a subir el camino, hacia un lado las ruinas de Sillustani y hacia el otro un hermosisimo paisaje de verdes, peque침os lagos, cerros. Las tumbas son impresionantes, enormes, erguidas como torres queriendo alcanzar el cielo. Comienza uno a recorrerla y cuando llega a la cima...de pronto...corta la respiraci칩n el paisaje: la vista de la laguna Umayo parece de ensue침o. Es como un premio a la larga caminata, t칩mense un momento para sentarse sobre las rocas e impregnarse de esa maravilla. "
3,10 junio 2015,Curioso,"Me gust치ron las vistas y los monumentos. Es curioso y algo misterioso.
No me gust칩 mucho las explicaciones, da la pinta que no saben muy bien del porque de dichos monumentos. Hay muchas teorias no comprobadas."
